idade,genero,existe_alguma_rua_em_fortaleza_em_que_gostaria_de_ver_uma_ciclovia,por_que_escolheu_ou_escolhe_andar_de_bicicleta_agrupado,ha_quanto_tempo_utiliza_agrupado,qual_e_o_principal_problema_que_voce_enfrenta_ao_andar_de_bicicleta_em_fortaleza_agrupado,tem_medo_de_sofrer_acidentes_andando_de_bicicleta_em_fortaleza_agrupado,sofreu_algum_acidente_no_ultimo_ano_agrupado,gostaria_de_trocar_a_bicicleta_por_outro_meio_de_transporte_agrupado
21 anos,Masculino,"Existe alguma rua em Fortaleza que você gostaria de ter ciclovia? Não. Todos os cantos em Fortaleza deveriam ter, né? Pelo céu? Sim. Mas pelos locais que você anda, já tem. Já tem.",Exercício e saúde,,Falta de ciclovias,"Sim, tenho medo de acidentes",Não,Não
39,Feminino,"Sim, principalmente na faixa de onde passam os colégios e tem muita movimentação na hora de pegar a criança e de deixar.",Rapidez \ Tempo; Segurança no trânsito,Mais de 5 anos,Sinalização inadequada,"Sim, tenho medo de acidentes",Não,Não
13 anos,Feminino,"E existe alguma rua aqui em Fortaleza que você gostaria que tivesse que ouvir? Não, eu não conheço muito aqui, que eu moro há pouco tempo.",Preferência pessoal,Mais de 5 anos,Desrespeito dos motoristas ou Trânsito,"Sim, tenho medo de acidentes",Não,Não
37 anos,Masculino,"Não sei, eu não ando muito, só aqui mesmo na escola. Só localmente, né?",Exercício e saúde,,Falta de ciclovias,"Sim, tenho medo de acidentes",Não,Não
32 anos,Masculino,"Eu gostaria que, pensando aqui onde eu moro, que o restante da... da Ministerral, do 3º Terminal, do Antônio Bezerra, até pelo menos a ponte, a rodoviária, tivesse ciclovisse e ciclofaixa também.",Exercício e saúde;Custo \ É mais barato;Praticidade e conveniência,Entre 2 e 3 anos,Má qualidade das ciclovias; Desrespeito dos motoristas ou Trânsito,"Sim, tenho medo de acidentes",Sim,Não
55 anos,Masculino,Existe algum ângulo que você gostaria de ter uma ciclovia? Eu vou morar hoje.,Rapidez \ Tempo,Mais de 5 anos,Buracos na ciclovia,"Sim, tenho medo de acidentes",Não,"Sim, por uma bicicleta melhor"
28 anos,Feminino,"Existe alguma rua que você gostaria de ver uma ciclovia? Sim. Podia até ser essa daqui, essa daqui era o detalhe do. Socoleta, da Popsicle.",Rapidez \ Tempo; Preferência pessoal,Mais de 5 anos,Desrespeito dos motoristas ou Trânsito; Risco de acidentes,"Sim, tenho medo de acidentes",Não,Não
35 anos,Masculino,"E existe aqui alguma rua em Fortaleza. Que você gostaria que tivesse uma ciclovia? Alguma específica aqui no bairro? Aqui tá muito bom de ciclovia, né? Mas. Essas ruas paralelas também, às vezes, não dá nem ter corrição, porque é muito estreita, né? Mas essa localização aqui era bom ter uma ciclovia, pelo menos. Tem colégio.",Preferência pessoal,Mais de 5 anos,Desrespeito dos motoristas ou Trânsito,"Sim, tenho medo de acidentes",Não,"Sim, por um carro"
56,Masculino,"A ciclovia é boa, a que botaram ali. Mas eu queria mais ainda que pelo menos quando você vê na sua mão. Certa, Aqui na rua da escola, por exemplo? Não tem, hein? Não tem essa que eu via. A estrada aqui é ruim. Você vê como é que tá a estrada aí. Não é só aqui não, tem canto de outros cantos aí. Lá em casa, que eu moro na Rio e eu tava aqui, em Jardim Guanabara, a minha rua é só na pedra. O asfalto tá feio demais, entendeu?",Única opção,Mais de 5 anos,Desrespeito dos motoristas ou Trânsito,Não,Não,"Sim, mas não especifica qual meio"
53 anos,Masculino,"Existe alguma rua em Fortaleza que você gostaria que tivesse uma ciclofaixa ou ciclovica e ainda não tem? Na. Verdade por onde eu ando tem, né? Não. Sei informar sempre onde eu ando tem, né?",Exercício e saúde;Rapidez \ Tempo,Mais de 5 anos,Desrespeito dos motoristas ou Trânsito,"Sim, tenho medo de acidentes",Sim,"Sim, mas não especifica qual meio"
47,Feminino,"Existe alguma rua que você gostaria de ter ciclovia? aqui no entorno. Não, isso aqui seria uma boa, essa rua aqui, por causa do colégio, né? Tem muito aluno que tem bicicleta, né? Ando, vai pro colégio de bicicleta, é o transporte.",Rapidez \ Tempo,,Desrespeito dos motoristas ou Trânsito; Má qualidade das ciclovias,"Sim, tenho medo de acidentes",Não,"Sim, por uma moto"
16,Masculino,"Existe alguma rua e fortaleza que você gostaria que tivesse? Ciclovia, Ciclopátia? Só Misterral. Misterral. Show de bola. Valeu. Obrigadão, viu?",Única opção,Mais de 5 anos,Desrespeito dos motoristas ou Trânsito,"Sim, tenho medo de acidentes",Sim,
16,Feminino,Existe algum rumo em Fortaleza que tu gostaria que tivesse uma cifra baixa?,Praticidade e conveniência;Mais fácil,Mais de 5 anos,Desrespeito dos motoristas ou Trânsito,"Sim, tenho medo de acidentes",Sim,"Sim, por uma moto"
51 anos,Masculino,"E existe alguma rua que você gostaria de ter ciclovia? Hoje. Em dia, as principais aqui no bairro aqui estão todas com ciclovia, está ótimo.",Exercício e saúde,Mais de 5 anos,Outros obstáculos na ciclovia,"Sim, tenho medo de acidentes",Sim,"Sim, por um carro"
65 anos,Masculino,"Existe alguma rua em Fortaleza que você gostaria que tivesse uma ciclovia, que ainda não tem? Ou alguma que está ruim, que iria melhorar? João Pessoa, Avenida. Não tem. É horrível pra chegar lá. Horrível, entendeu? Geralmente a gente escolhe mais a Zé Baixo, né? Que agora é outro nome. No meu tempo era Zé Baixo, agora é outro nome.",Exercício e saúde,Mais de 5 anos,Invasão de carros ou motos na ciclovia; Desrespeito dos motoristas ou Trânsito,"Sim, tenho medo de acidentes",Sim,Não
46 anos,Masculino,"E tem alguma rua aqui em Fortaleza que você gostaria que tivesse na ciclovia, ciclofaixa? Oi? Aqui já tá quase tudo pavimentadozinho, né? Divertido, né? Tá. Perfeito.",Custo \ É mais barato,Mais de 5 anos,Desrespeito dos motoristas ou Trânsito,"Sim, tenho medo de acidentes",Não,"Sim, por uma moto"
36 anos,Feminino,"Existe alguma rua que você gostaria de ter uma ciclovia aqui pra onde você anda? Essa rua aí é a Major Assis, que é a rua que eu vejo.",Segurança no trânsito; Exercício e saúde,Mais de 5 anos,Desrespeito dos motoristas ou Trânsito,"Sim, tenho medo de acidentes",Sim,Não
60 anos,Masculino,"Existe alguma rua que você gostaria de ter ciclovia? Aqui? Aqui? Ou em algum outro lugar também, em Fortaleza? Não, a nossa tem. Só não tem nessas fechadas aqui assim, não boto, né? Mas... Mas você gostaria que tivesse? Ah, era bom demais. Com certeza melhoraria demais pra gente.",Praticidade e conveniência,Não aplicável,Desrespeito dos motoristas ou Trânsito,"Sim, tenho medo de acidentes",Sim,Não
40 anos,Masculino,"Aqui na Majorce já melhorou muito, né, mano? A avenida que é a principal é melhor, né? Que é onde os homens trabalham mais rápido.",Rapidez \ Tempo,Mais de 5 anos,Desrespeito dos motoristas ou Trânsito; Medo de assaltos,"Sim, tenho medo de acidentes",Sim,Não
11 anos,Masculino,Aí tu gostaria que tivesse uma ciclofaixa na rua da tua casa? Uma ciclovia? Sim. Ou aqui na rua da escola? Queria muito.,Preferência pessoal,Entre 3 e 5 anos,,Não,Não,"Sim, por uma moto ou por um carro"
31 anos,Feminino,"Assim como eu ando muito no bairro só, aí eu não tenho muito acesso às outras não, mas pelo bairro tá tudo tranquilo. Ótimo.",Rapidez \ Tempo; Mais fácil; Praticidade e conveniência,"Não se aplica, pois a pessoa não menciona há quanto tempo utiliza a bicicleta.",Desrespeito dos motoristas ou Trânsito; Risco de acidentes,"Sim, tenho medo de acidentes",Não,"Sim, por uma moto ou por um carro"
43 anos,Feminino,"Mulher, eu gostaria que tivesse mais ciclovias, né? Eu sei que tem muitas, só que não é suficiente, né? Pra proteger o ciclista, né? Que o ciclista é frágil, né? Pelo menos é frágil, porque tá numa bicicleta, né? A bicicleta é um desafio frágil, né?",Praticidade e conveniência; Preferência pessoal,Mais de 5 anos,Desrespeito dos motoristas ou Trânsito; Risco de acidentes,"Sim, tenho medo de acidentes",Sim,Não
65 anos,Masculino,"E existe alguma rua que você gostaria que tivesse ciclovia? Ah, tem rua que ciclovia aí na...",Preferência pessoal,,Calor ou clima; Desrespeito dos motoristas ou Trânsito,"Sim, tenho medo de acidentes",Sim,Não
59 anos,Masculino,"E existe alguma rua aqui em Fortaleza, Dubai, que o senhor gostaria que tivesse uma ciclovia, ciclofaixa? Rapaz... Pra mim, se todos estivessem, era melhor.",,Mais de 5 anos,Falta de ciclovias,"Sim, tenho medo de acidentes",Não,"Sim, mas não especifica qual meio"
60 anos,Masculino,"Rapaz, só lá em cima lá, lá na... Não sei o que chama, Marujali.",Única opção; Rapidez \ Tempo,,,"Sim, tenho medo de acidentes",Sim,"Sim, mas não especifica qual meio"
18,Masculino,"Existe alguma rua que você gostaria de ter uma ciclovia? Aqui, por onde você anda, ou em outro lugar? Por aqui mesmo. Pronto.",Praticidade e conveniência,,Desrespeito dos motoristas ou Trânsito,"Sim, tenho medo de acidentes",Não,"Sim, por uma moto"
12 anos,Masculino,"Existe alguma rua que você gostaria que tivesse uma ciclofaixa? Fortaleza? Tipo assim, nessa rua que o pessoal vai embora pra escola, que é mais perigoso, que passa muito carro.",Preferência pessoal,Entre 2 e 3 anos,Desrespeito dos motoristas ou Trânsito,"Sim, tenho medo de acidentes",Não,"Sim, por uma moto"
47 anos,Feminino,"Existe alguma rua em Fortaleza que você gostaria que tivesse uma ciclofaixa? Que ainda não tem? Não, não me recordo agora, não.",Preferência pessoal,Mais de 5 anos,Desrespeito dos motoristas ou Trânsito,"Sim, tenho medo de acidentes",Não,"Sim, mas não especifica qual meio"
66 anos,Masculino,"Existe alguma rua em Fortaleza que o senhor gostaria que tivesse uma ciclofaixa? Ou alguma que tá ruim pra melhorar? Pronto, essa avenida aí tá horrível, velho. Essa ciclofaixa aí, a da Coronel Carvalho, não existe. Pegando aqui até a Barra, não existe jeito nenhum.",Preferência pessoal,Mais de 5 anos,Lixo na ciclovia; Risco de acidentes; Má qualidade das ciclovias,"Sim, tenho medo de acidentes",Sim,Não
