text,conversation,file,nome,idade,gênero,por_que_escolheu_andar_de_bicicleta?,ha_quanto_tempo_utiliza?,qual_e_o_principal_problema_que_voce_enfrenta_ao_andar_de_bicicleta_em_fortaleza,tem_medo_de_sofrer_acidentes_andando_de_bicicleta_em_Fortaleza?,sofreu_algum_acidente_no_último_ano?,gostaria_de_trocar_a_bicicleta_por_outro_meio_de_transporte,existe_alguma_rua_em_fortaleza_em_que_gostaria_de_ver_uma_ciclovia,por_que_escolheu_ou_escolhe_andar_de_bicicleta_agrupado,ha_quanto_tempo_utiliza_agrupado,qual_e_o_principal_problema_que_voce_enfrenta_ao_andar_de_bicicleta_em_fortaleza_agrupado,tem_medo_de_sofrer_acidentes_andando_de_bicicleta_em_fortaleza_agrupado,sofreu_algum_acidente_no_ultimo_ano_agrupado,gostaria_de_trocar_a_bicicleta_por_outro_meio_de_transporte_agrupado
"Sim. Vamos lá. Me diz seu nome e a tua idade, por favor. Meu nome é Jacob e eu tenho 39 anos. Jacob, por que que você escolheu andar de bicicleta e há quanto tempo que você utiliza ela como meio de transporte? Há uns 4 anos atrás eu descobri o ciclismo e aprendi a gostar e de um ano pra cá eu tô trabalhando com a iFood e entregando de bike. E qual que é o seu problema que você enfrenta ao andar de bicicleta? Comparando Fortaleza com outros estados em qual já conheço e já pedalei, Fortaleza tem ciclovias bacanas, algumas elas estão precisando de reformas, elas estão bem estreitas ou tem calçada em cima da ciclovia, isso atrapalha um pouco. Tu tem medo de sofrer acidente andando de bicicleta com Fortaleza? Não. Já sofreu algum acidente, aliás, sofreu algum acidente no último ano? Não. Não, né? Legal. Tu gosta de trocar bicicleta por outro meio de transporte? Pra lazer, trocar bicicleta não. Pra trabalho sim. Pra entregar. Continuar no iFood por moto. Tá. Existe alguma rua aqui em Fortaleza que o Kirito é ciclovia ou ciclopasta e não tem hoje? Por onde eu tô rodando tá tranquilo. Já tem? Tem. Tá bom. Obrigado.","Pessoa A: Sim. Vamos lá. Me diz seu nome e a tua idade, por favor. Meu nome é Jacob e eu tenho 39 anos. Jacob, por que que você escolheu andar de bicicleta e há quanto tempo que você utiliza ela como meio de transporte? Há uns 4 anos atrás eu descobri o ciclismo e aprendi a gostar e de um ano pra cá eu tô trabalhando com a iFood e entregando de bike. E qual que é o seu problema que você enfrenta ao andar de bicicleta? Comparando Fortaleza com outros estados em qual já conheço e já pedalei, Fortaleza tem ciclovias bacanas, algumas elas estão precisando de reformas, elas estão bem estreitas ou tem calçada em cima da ciclovia, isso atrapalha um pouco. Tu tem medo de sofrer acidente andando de bicicleta com Fortaleza? Não. Já sofreu algum acidente, aliás, sofreu algum acidente no último ano? Não. Não, né? Legal. Tu gosta de trocar bicicleta por outro meio de transporte? Pra lazer, trocar bicicleta não. Pra trabalho sim. Pra entregar. Continuar no iFood por moto. Tá. Existe alguma rua aqui em Fortaleza que o Kirito é ciclovia ou ciclopasta e não tem hoje? Por onde eu tô rodando tá tranquilo. Já tem? Tem. Tá bom. Obrigado.",00003006-AUDIO-2026-02-26-16-15-12,Jacob,39 anos,Masculino,Há uns 4 anos atrás eu descobri o ciclismo e aprendi a gostar e de um ano pra cá eu tô trabalhando com a iFood e entregando de bike.,de um ano pra cá eu tô trabalhando com a iFood e entregando de bike.,"Fortaleza tem ciclovias bacanas, algumas elas estão precisando de reformas, elas estão bem estreitas ou tem calçada em cima da ciclovia, isso atrapalha um pouco.",Tu tem medo de sofrer acidente andando de bicicleta com Fortaleza? Não.,"Já sofreu algum acidente, aliás, sofreu algum acidente no último ano? Não. Não, né?","Tu gosta de trocar bicicleta por outro meio de transporte? Pra lazer, trocar bicicleta não. Pra trabalho sim. Pra entregar. Continuar no iFood por moto.",Existe alguma rua aqui em Fortaleza que o Kirito é ciclovia ou ciclopasta e não tem hoje? Por onde eu tô rodando tá tranquilo. Já tem? Tem.,Preferência pessoal; Praticidade e conveniência,Entre 1 e 2 anos,"Má qualidade das ciclovias, Outros obstáculos na ciclovia",Não,Não,"Sim, por uma moto"
"Por que você escolheu andar de bicicleta e quanto tempo você utiliza? Eu faço 40 minutos mais tarde. Certo. Qual o seu nome e sua idade? 64. Eu vou fazer 65 agora em agosto. E o seu nome? Luiz Feira Filho. Qual é o principal problema que você enfrenta ao andar de bicicleta? É porque, pra andar de ônibus, custa demais. O percurso é muito ruim de andar de ônibus. Tem que concorrer pra ir de ônibus, dela duas horas pra chegar lá. De bicicleta, quarenta minutos. E andando de bicicleta, tem algum obstáculo que você queria melhorar? Tem, né? Que nada é fácil, né? Nada é fácil. Você tem medo de sofrer acidente andando de bicicleta? Não, não. Já sofreu algum acidente? Só de moto. Você gostaria de trocar a bicicleta por algum outro meio de transporte? Meu pensamento? É, por qual? Eu preciso de um bom carro pra mim. E existe alguma rua em Fortaleza que você gostaria de ter ciclovia? Não, não tô entendendo. É, ciclovia. Não, quase toda via tem. Não tem nenhum específico que você anda que não tem? Não. Tá. Obrigada, é só isso.","Pessoa A: Por que você escolheu andar de bicicleta e quanto tempo você utiliza?
Pessoa B: Eu faço 40 minutos mais tarde.
Pessoa A: Certo. Qual o seu nome e sua idade?
Pessoa B: 64. Eu vou fazer 65 agora em agosto.
Pessoa A: E o seu nome?
Pessoa B: Luiz Feira Filho.
Pessoa A: Qual é o principal problema que você enfrenta ao andar de bicicleta?
Pessoa B: É porque, pra andar de ônibus, custa demais. O percurso é muito ruim de andar de ônibus. Tem que concorrer pra ir de ônibus, dela duas horas pra chegar lá. De bicicleta, quarenta minutos.
Pessoa A: E andando de bicicleta, tem algum obstáculo que você queria melhorar?
Pessoa B: Tem, né? Que nada é fácil, né?
Pessoa A: Nada é fácil. Você tem medo de sofrer acidente andando de bicicleta? Não,
Pessoa B: não. Já
Pessoa A: sofreu algum acidente?
Pessoa B: Só de moto.
Pessoa A: Você gostaria de trocar a bicicleta por algum outro meio de transporte?
Pessoa B: Meu pensamento?
Pessoa A: É, por qual?
Pessoa B: Eu preciso de um bom carro pra mim.
Pessoa A: E existe alguma rua em Fortaleza que você gostaria de ter ciclovia?
Pessoa B: Não, não tô entendendo. É,
Pessoa A: ciclovia. Não, quase toda via tem.
Pessoa B: Não tem nenhum específico que você anda que não tem? Não. Tá.
Pessoa A: Obrigada, é só isso.",00003007-AUDIO-2026-02-26-16-16-16,Luiz Feira Filho,64,Masculino,Há uns 4 anos atrás eu descobri o ciclismo e aprendi a gostar e de um ano pra cá eu tô trabalhando com a iFood e entregando de bike.,de um ano pra cá eu tô trabalhando com a iFood e entregando de bike.,"É porque, pra andar de ônibus, custa demais. O percurso é muito ruim de andar de ônibus. Tem que concorrer pra ir de ônibus, dela duas horas pra chegar lá. De bicicleta, quarenta minutos","Você tem medo de sofrer acidente andando de bicicleta? Não, não.","Já sofreu algum acidente, aliás, sofreu algum acidente no último ano? Não. Não, né?","Você gostaria de trocar a bicicleta por algum outro meio de transporte? Meu pensamento? É, por qual? Eu preciso de um bom carro pra mim.","E existe alguma rua em Fortaleza que você gostaria de ter ciclovia? Não, não tô entendendo. É, ciclovia. Não, quase toda via tem. Não tem nenhum específico que você anda que não tem? Não. Tá. Obrigada, é só isso.",Preferência pessoal,Entre 1 e 2 anos,Outros obstáculos na ciclovia,Não,Não,"Sim, por um carro"
"Me fala o teu nome e a tua idade? Albêniz de Araújo Nogueira. Idade? Meia unha. Por que você escolheu andar de bicicleta e quanto tempo que você usa? Porque é mais rápido. E também, segundo que também não gasta gasolina, né cara? É mais barato também, né? Tem quanto tempo que você usa bicicleta, mais ou menos? Eu já tô com mais de 30 anos. Qual é o principal problema que você enfrenta ao andar de bicicleta? Rapaz, é de atividade, né? Que a gente tem que ter, né? Atividade, né? Atividade? Mas qual é o problema que você vê assim na rua? O problema é a atividade minha, sua e de todo mundo. Porque se todo mundo tivesse atividade, não acontecia tanto acidente, né? Você tem medo de sofrer acidente? Eu tenho, porque a pior coisa que tem é a doença. Você já sofreu algum acidente de bicicleta? Não, graças a Deus, não. Você gostaria de trocar a bicicleta por outro meio de transporte? Rapaz, eu não. Não, não. Eu não vou passar por isso. Eu não vou nem ver os votos que eu sei que eu vou ganhar, né? Obrigado. Tem alguma rua em Fortaleza que você acha que devia ter ciclofaixa, que hoje não tem, pra sugerir? Alguma que você faça... Eu roto mais na Freicilíneo aqui. Freicilíneo não tem, né? Eu roto mais na Freicilíneo. Aquela lá, né, Tandirinho? Aquela é uma que poderia ter ciclofaixa, né? Excelente, excelente, excelente. Tá bom. Ótimo, ótimo, ótimo. Obrigado. Pois é, amigão.","Pessoa B: Me fala o teu nome e a tua idade?
Pessoa A: Albêniz de Araújo Nogueira.
Pessoa B: Idade?
Pessoa A: Meia unha.
Pessoa B: Por que você escolheu andar de bicicleta e quanto tempo que você usa?
Pessoa A: Porque é mais rápido. E também, segundo que também não gasta gasolina, né cara? É mais barato
Pessoa B: também, né?
Pessoa A: Tem
Pessoa B: quanto tempo que você usa bicicleta, mais ou menos?
Pessoa A: Eu já tô com mais de 30 anos.
Pessoa B: Qual é o principal problema que você enfrenta ao andar de bicicleta?
Pessoa A: Rapaz, é de atividade, né? Que a gente tem que ter, né? Atividade, né?
Pessoa B: Atividade? Mas qual é o problema que você vê assim na rua? O problema é a
Pessoa A: atividade minha, sua e de todo mundo. Porque se todo mundo tivesse atividade, não acontecia tanto acidente, né?
Pessoa B: Você tem medo de sofrer acidente?
Pessoa A: Eu tenho, porque a pior coisa que tem é a doença.
Pessoa B: Você já sofreu algum acidente de
Pessoa A: bicicleta? Não, graças a Deus, não.
Pessoa B: Você gostaria de trocar a bicicleta por outro meio de transporte?
Pessoa A: Rapaz, eu não. Não, não. Eu não vou passar por isso. Eu não vou nem ver os votos que eu sei que eu vou ganhar, né? Obrigado.
Pessoa B: Tem alguma rua em Fortaleza que você acha que devia ter ciclofaixa, que hoje não tem, pra sugerir? Alguma que você faça... Eu
Pessoa A: roto mais na Freicilíneo aqui.
Pessoa B: Freicilíneo não tem, né? Eu
Pessoa A: roto mais na Freicilíneo. Aquela lá, né,
Pessoa B: Tandirinho? Aquela é uma que poderia ter ciclofaixa, né?
Pessoa A: Excelente, excelente, excelente.
Pessoa B: Tá bom. Ótimo,
Pessoa A: ótimo, ótimo.
Pessoa B: Obrigado.
Pessoa A: Pois é, amigão.",00003008-AUDIO-2026-02-26-16-17-13,Albêniz de Araújo Nogueira,Meia unha (51 anos),Masculino,"Porque é mais rápido. E também, segundo que também não gasta gasolina, né cara? É mais barato também, né?",Eu já tô com mais de 30 anos.,"O problema é a responsabilidade minha, sua e de todo mundo. Porque se todo mundo tivesse responsabilidade, não acontecia tanto acidente, né?","Você tem medo de sofrer acidente? Eu tenho, porque a pior coisa que tem é a doença.","Já sofreu algum acidente, aliás, sofreu algum acidente no último ano? Não. Não, né?","Rapaz, eu não. Não, não.","""Tem alguma rua em Fortaleza que você acha que devia ter ciclofaixa, que hoje não tem, pra sugerir? Alguma que você faça... Eu roto mais na Freicilíneo aqui. Freicilíneo não tem, né? Eu roto mais na Freicilíneo. Aquela lá, né, Tandirinho? Aquela é uma que poderia ter ciclofaixa, né?""",Rapidez \ Tempo; Custo \ É mais barato,Mais de 5 anos,Risco de acidentes,"Sim, tenho medo de acidentes",Não,Não
"Seu nome e sua idade? Renato Souza. E a idade? Trinta e sete. Por que você escolheu andar de bicicleta e quanto tempo utiliza? Faz o tempo, há um bocado de anos. Desde cedo, desde criança? Desde cedo, desde criança. Por que você utiliza aquilo que você escolheu? Primeiro, manter a saúde, mais econômico e a poluição, né? Menos poluição. Qual o principal problema que você enfrenta andando de bicicleta? Só as vias, às vezes, obstruídas. Você tem medo de sofrer acidente andando de bicicleta? Com certeza. Já chegou a sofrer algum? Não, graças a Deus, não. Gostaria de trocar a bicicleta por algum outro meio de transporte? Os mesmos. E existe alguma rua que você gostaria de ver uma ciclovia? Várias, agora o nome eu não me lembro. Aqui na Messiana mesmo? Se tiver um ponto de referência também. Que é várias ruas a gente não lembra. Mas gostaria demais. Quanto mais ciclo a ver, melhor. Obrigada, é bom ser só isso.","Pessoa A: Seu nome e sua idade?
Pessoa B: Renato Souza.
Pessoa A: E a idade?
Pessoa B: Trinta e sete.
Pessoa A: Por que você escolheu andar de bicicleta e quanto tempo utiliza?
Pessoa B: Faz o tempo, há um bocado de anos.
Pessoa A: Desde cedo, desde criança?
Pessoa B: Desde cedo, desde criança.
Pessoa A: Por que você utiliza aquilo que você escolheu?
Pessoa B: Primeiro, manter a saúde, mais econômico e a poluição, né? Menos poluição.
Pessoa A: Qual o principal problema que você enfrenta andando de bicicleta?
Pessoa B: Só as vias, às vezes, obstruídas.
Pessoa A: Você tem medo de sofrer acidente andando de bicicleta? Com
Pessoa B: certeza.
Pessoa A: Já chegou a sofrer algum?
Pessoa B: Não, graças a Deus, não.
Pessoa A: Gostaria de trocar a bicicleta por algum outro meio de transporte?
Pessoa B: Os mesmos.
Pessoa A: E existe alguma rua que você gostaria de ver uma ciclovia?
Pessoa B: Várias, agora o nome eu não me lembro.
Pessoa A: Aqui na Messiana mesmo?
Pessoa B: Se
Pessoa A: tiver um ponto de referência também.
Pessoa B: Que é várias ruas a gente não lembra.
Pessoa A: Mas gostaria demais.
Pessoa B: Quanto mais ciclo a ver, melhor.
Pessoa A: Obrigada, é bom ser só isso.",00003009-AUDIO-2026-02-26-16-17-37,Renato Souza,Trinta e sete,Masculino,"Primeiro, manter a saúde, mais econômico e a poluição, né? Menos poluição.","Faz o tempo, há um bocado de anos. Desde cedo, desde criança.","Só as vias, às vezes, obstruídas",Você tem medo de sofrer acidente andando de bicicleta? Com certeza.,"Já sofreu algum acidente, aliás, sofreu algum acidente no último ano? Não. Não, né?",Gostaria de trocar a bicicleta por algum outro meio de transporte? Os mesmos.,"E existe alguma rua que você gostaria de ver uma ciclovia? Várias, agora o nome eu não me lembro. Aqui na Messiana mesmo? Se tiver um ponto de referência também. Que é várias ruas a gente não lembra. Mas gostaria demais. Quanto mais ciclo a ver, melhor.",Exercício e saúde; Custo \ É mais barato; Praticidade e conveniência,Mais de 5 anos,Outros obstáculos na ciclovia,"Sim, tenho medo de acidentes",Não,"Sim, por uma moto"
"Me diz, por favor, teu nome e a tua idade? Igor Arigirão, 40 anos. Igor, por que você escolheu andar de bicicleta e há quanto tempo você utiliza ela como meio de transporte? 20 anos já. Porque é mais rápido, né? Prático. Entendi. Qual o problema que você enfrenta ao andar de bicicleta em Fortaleza? O trânsito, né? Tem motorista que não respeita a gente. Você tem medo de sofrer acidente andando de bicicleta aqui em Fortaleza? Tenho. E tu sofreu algum acidente no último ano? Não. Não, né? Tu gostaria de trocar a bicicleta por outro meio de transporte? Não. Não, né? E existe algum rio aqui em Fortaleza que tu gostaria que tivesse ciclovia ou ciclofaixa e não tem hoje? A Avenida Perimetral aqui. A Perimetral, né? É. Bacana. Valeu, obrigado, hein?","Pessoa B: Me diz, por favor, teu nome e a tua idade?
Pessoa A: Igor Arigirão,
Pessoa B: 40 anos. Igor, por que você escolheu andar de bicicleta e há quanto tempo você utiliza ela como meio de transporte?
Pessoa A: 20 anos já.
Pessoa B: Porque é mais rápido, né? Prático. Entendi. Qual o problema que você enfrenta ao andar de bicicleta em Fortaleza?
Pessoa A: O trânsito, né? Tem motorista que não respeita a gente.
Pessoa B: Você tem medo de sofrer acidente andando de bicicleta aqui em Fortaleza?
Pessoa A: Tenho.
Pessoa B: E tu sofreu algum acidente no último ano?
Pessoa A: Não.
Pessoa B: Não, né? Tu gostaria de trocar a bicicleta por outro meio de transporte?
Pessoa A: Não.
Pessoa B: Não, né? E existe algum rio aqui em Fortaleza que tu gostaria que tivesse ciclovia ou ciclofaixa e não tem hoje? A Avenida Perimetral aqui. A Perimetral, né? É. Bacana. Valeu, obrigado, hein?",00003010-AUDIO-2026-02-26-16-19-20,Igor Arigirão,40 anos,Masculino,"Porque é mais rápido, né? Prático.",20 anos já.,"O trânsito, né? Tem motorista que não respeita a gente.",Você tem medo de sofrer acidente andando de bicicleta aqui em Fortaleza? Tenho.,"E tu sofreu algum acidente no último ano? Não. Não, né?","Você gostaria de trocar a bicicleta por algum outro meio de transporte? Meu pensamento? É, por qual? Eu preciso de um bom carro pra mim.","E existe algum rio aqui em Fortaleza que tu gostaria que tivesse ciclovia ou ciclofaixa e não tem hoje? A Avenida Perimetral aqui. A Perimetral, né? É.",Rapidez \ Tempo; Praticidade e conveniência,Mais de 5 anos,Desrespeito dos motoristas ou Trânsito,"Sim, tenho medo de acidentes",Não,"Sim, por um carro"
"Qual o seu nome e a sua idade? Carlos Messejana. Sua idade? Quarenta anos. Por que você escolheu andar de bicicleta e quanto tempo utiliza, mais ou menos? Mais de cinco anos. É saúde, né? Pedalar, né? Qual o principal problema que você enfrenta andando de bicicleta? É mais o respeito que o povo não respeita a bicicleta. Você tem medo de sofrer acidente andando de bicicleta? Sim, tenho medo, sim. Já sofreu algum? Não. Sempre atento. Você gostaria de trocar bicicleta pra algum outro meio de transporte? No momento, não. E existe alguma rua que você gostaria de ver uma ciclovia em Fortaleza que ainda não tenha? Agora, no momento... Não tô lembrado não, mas não sei o nome da rua lá. Se tiver algum ponto de referência, assim, também. Não tô lembrado lá. Tudo bem. Mas já tá assistido. Pelo menos que você anda... É, não sei o nome da rua.","Pessoa A: Qual o seu nome e a sua idade?
Pessoa B: Carlos Messejana.
Pessoa A: Sua idade?
Pessoa B: Quarenta anos.
Pessoa A: Por que você escolheu andar de bicicleta e quanto tempo utiliza, mais ou menos?
Pessoa B: Mais de cinco anos. É saúde, né? Pedalar, né?
Pessoa A: Qual o principal problema que você enfrenta andando de bicicleta?
Pessoa B: É mais o respeito que o povo não respeita a bicicleta.
Pessoa A: Você tem medo de sofrer acidente andando de bicicleta?
Pessoa B: Sim, tenho medo, sim.
Pessoa A: Já sofreu algum?
Pessoa B: Não. Sempre atento.
Pessoa A: Você gostaria de trocar bicicleta pra algum outro meio de transporte? No momento, não. E existe alguma rua que você gostaria de ver uma ciclovia em Fortaleza que ainda não tenha?
Pessoa B: Agora, no momento... Não tô lembrado não, mas não sei o nome da rua lá.
Pessoa A: Se tiver algum ponto de referência, assim, também.
Pessoa B: Não tô lembrado lá.
Pessoa A: Tudo bem. Mas já tá assistido. Pelo menos que você anda... É,
Pessoa B: não sei o nome da rua.",00003011-AUDIO-2026-02-26-16-19-29,Carlos Messejana,Quarenta anos,Masculino,"É saúde, né? Pedalar, né?",Mais de cinco anos.,É mais o respeito que o povo não respeita a bicicleta.,"Sim, tenho medo, sim.","Já sofreu algum acidente, aliás, sofreu algum acidente no último ano? Não. Não, né?","No momento, não.","E existe alguma rua que você gostaria de ver uma ciclovia em Fortaleza que ainda não tenha? Agora, no momento... Não tô lembrado não, mas não sei o nome da rua lá. Se tiver algum ponto de referência, assim, também. Não tô lembrado lá. Tudo bem. Mas já tá assistido. Pelo menos que você anda... É, não sei o nome da rua.",Exercício e saúde,Mais de 5 anos,Desrespeito dos motoristas ou Trânsito,"Sim, tenho medo de acidentes",Não,"Sim, por uma moto"
"Como é o nome e a idade do senhor? Wagner. 48 anos. Faz quanto tempo que você anda de bicicleta? Desde sempre. Desde sempre? Mais de 20 anos? Mais de 20 anos. E por que você escolheu andar de bicicleta? É questão da saúde, curtir o vento, não ter a brisa. Eu dou aula de capoeira na... Eu tenho trabalho aqui e dou aula de capoeira na Mangabeira, no Zé. Treze anos de bicicleta. É bem longe. Mais de vinte anos já. Então é mais questão de exercício, essas coisas, né? E qual é o principal problema que você enfrenta quando anda de bicicleta em Fortaleza? A questão dos carros não respeitarem o ciclista. Desrespeito do motorista, né? Hoje, até ok, mas quando sai fora da cidade, eu pego os carros no fio, O senhor tem medo de sofrer um acidente? E o senhor sofreu um acidente nos últimos anos? Só uma vez, mas faz tempo. O senhor gostaria de trocar hoje a bicicleta por outro meio de transporte? Num momento não. Não, né? E tem alguma rua que o senhor passe assim todo dia, no seu dia a dia, que não tenha faixa de ciclovia, né? Que é essa infraestrutura que tem aqui, por exemplo, mas o senhor acha que deveria ter? Aqui em Fortaleza, né? Eu digo assim, eu não conheço por nome. Onde mais tem? Que é a divisa aqui do Flotinha pra chegar pra Paraíso. Esse trecho aqui. Aqui na Messejana mesmo ainda, né? Flotinha. Aqui o Flotinha que vem aqui na Messejana. O novo Flotinha. E aí entra de esquerda, vai sair de aval, pra lá eles me dão acesso a Palmeiras. É, não conheço não. Mas eu posso olhar no Maps depois.","Pessoa A: Como é o nome e a idade do senhor?
Pessoa B: Wagner. 48 anos.
Pessoa A: Faz quanto tempo que você anda de bicicleta?
Pessoa B: Desde sempre.
Pessoa A: Desde sempre? Mais de 20 anos?
Pessoa B: Mais de 20 anos.
Pessoa A: E por que você escolheu andar de bicicleta?
Pessoa B: É questão da saúde, curtir o vento, não ter a brisa. Eu dou aula de capoeira na... Eu tenho trabalho aqui e dou aula de capoeira na Mangabeira, no Zé. Treze anos de bicicleta.
Pessoa A: É bem longe.
Pessoa B: Mais de vinte anos já.
Pessoa A: Então é mais questão de exercício, essas coisas, né? E qual é o principal problema que você enfrenta quando anda de bicicleta em Fortaleza?
Pessoa B: A questão dos carros não respeitarem o ciclista.
Pessoa A: Desrespeito do motorista, né?
Pessoa B: Hoje, até ok, mas quando sai fora da cidade, eu pego os carros no fio, O senhor
Pessoa A: tem medo de sofrer um acidente?
Pessoa B: E o senhor sofreu um acidente nos últimos anos?
Pessoa A: Só uma vez, mas faz tempo. O senhor gostaria de trocar hoje a bicicleta por outro meio de transporte?
Pessoa B: Num momento não. Não, né?
Pessoa A: E tem alguma rua que o senhor passe assim todo dia, no seu dia a dia, que não tenha faixa de ciclovia, né? Que é essa infraestrutura que tem aqui, por exemplo, mas o senhor acha que deveria ter? Aqui em Fortaleza, né? Eu digo assim, eu não conheço por nome.
Pessoa B: Onde mais tem? Que é a divisa aqui do Flotinha pra chegar pra Paraíso. Esse trecho aqui.
Pessoa A: Aqui na Messejana mesmo ainda, né? Flotinha.
Pessoa B: Aqui o Flotinha que vem aqui na Messejana. O novo Flotinha. E aí entra de esquerda, vai sair de aval, pra lá eles me dão acesso a Palmeiras. É, não conheço não.
Pessoa A: Mas eu posso olhar no Maps depois.",00003012-AUDIO-2026-02-26-16-20-54,Wagner,48 anos,Masculino,"É questão da saúde, curtir o vento, não ter a brisa. Eu dou aula de capoeira na... Eu tenho trabalho aqui e dou aula de capoeira na Mangabeira, no Zé. Treze anos de bicicleta. É bem longe. Mais de vinte anos já. Então é mais questão de exercício, essas coisas, né?",Desde sempre. Mais de 20 anos.,"A questão dos carros não respeitarem o ciclista. Desrespeito do motorista, né?",Tu tem medo de sofrer acidente andando de bicicleta com Fortaleza? Não.,"E o senhor sofreu um acidente nos últimos anos? Só uma vez, mas faz tempo.",Num momento não.,"E tem alguma rua que o senhor passe assim todo dia, no seu dia a dia, que não tenha faixa de ciclovia, né? Que é essa infraestrutura que tem aqui, por exemplo, mas o senhor acha que deveria ter? Aqui em Fortaleza, né? Eu digo assim, eu não conheço por nome. Onde mais tem? Que é a divisa aqui do Flotinha pra chegar pra Paraíso. Esse trecho aqui. Aqui na Messejana mesmo ainda, né? Flotinha. Aqui o Flotinha que vem aqui na Messejana. O novo Flotinha. E aí entra de esquerda, vai sair de aval, pra lá eles me dão acesso a Palmeiras. É, não conheço não. Mas eu posso olhar no Maps depois.",Exercício e saúde;Preferência pessoal,Mais de 5 anos,Desrespeito dos motoristas ou Trânsito,Não,Sim,Não
