text,conversation,file,nome,idade,gênero,por_que_escolheu_andar_de_bicicleta?,ha_quanto_tempo_utiliza?,qual_e_o_principal_problema_que_voce_enfrenta_ao_andar_de_bicicleta_em_fortaleza,tem_medo_de_sofrer_acidentes_andando_de_bicicleta_em_Fortaleza?,sofreu_algum_acidente_no_último_ano?,gostaria_de_trocar_a_bicicleta_por_outro_meio_de_transporte,existe_alguma_rua_em_fortaleza_em_que_gostaria_de_ver_uma_ciclovia,por_que_escolheu_ou_escolhe_andar_de_bicicleta_agrupado,ha_quanto_tempo_utiliza_agrupado,qual_e_o_principal_problema_que_voce_enfrenta_ao_andar_de_bicicleta_em_fortaleza_agrupado,tem_medo_de_sofrer_acidentes_andando_de_bicicleta_em_fortaleza_agrupado,sofreu_algum_acidente_no_ultimo_ano_agrupado,gostaria_de_trocar_a_bicicleta_por_outro_meio_de_transporte_agrupado
"Muito bem. Como é o nome e a idade do senhor? Eu tenho, meu nome é Aurecédio Gonçalves, tenho 49. 49, né? Por que que o senhor escolheu andar de bicicleta? Cara, é assim, esse negócio de andar de bicicleta é uma coisa que já é, já é de, já vim do interior, que eu sou do interior. Entendi, é bem que sempre é dado. É bem que sempre é assim. Eu cheguei aqui em Fortaleza em 2001, mas nunca perdi o hábito de pedalar. A primeira coisa que eu consegui para mim foi uma bicicleta para ir trabalhar. Então, o seu pé dala desde sempre? Desde sempre. E qual é o principal problema que o senhor enfrenta andando de bicicleta aqui em Fortaleza? Do que de respeito com a gente, até nessas horas que você dentro da própria ciclovia, a gente enfrenta muita dificuldade. O motoqueiro vem contra a gente, O carro mesmo invade a ciclovia pra querer passar de outro. Aqui mesmo, nesse trecho aqui que eu já vou aqui, lá um pouco mais atrás... Uma moto foi entrar pro posto, nem sinal deu. Se eu não tivesse olhando bem, cuidadosamente, pra frente, tinha... Dois motoqueiros tinham fechado, outra vez foi um carro também. Geralmente, quando tem acesso assim, eles... Isso. Muitas vezes, eles aproveitam o posto pra disfarçar o que vai abastecer. Aí entra o posto, vê do posto, faz a volta pra pegar lá e tá aí. Pra seguir. Entendi. Furar o semáforo, né? Entra pelo posto pra furar o sinal. Pra pegar a outra que vem aqui e passar pra lá. E aí, no decorrer que eles fazem isso, eles prejudicam a gente, porque já enfrentei um momento que o cara tá dentro da ciclovia pra vir bater de frente comigo e me esculhambar, entendeu? Já peguei isso. Isso aqui, durante o dia, a gente passa por muita... O desrespeito, né, de motorista. Exatamente. É tanto que hoje... A principal reclamação das pessoas é essa mesmo. Pois é, o desrespeito com a gente, porque nós temos a nossa coisa e os caras que vêm pra fazer retorno, não de pegar cinco ou via, eles não respeitam aquela faixa grande e vermelha que tem lá com tudo certo. É parar aqui e o nosso EV ficar certo, porque se a via tá lá, tá dando... A gente tem o direito da gente ir. Eles param aqui pra deixar a gente passar. O cara quase me derruba, quase me joga no meio do outro lado, que eu tava com o jeito que veio de uma placarca. Passou quatro dedos daqui, porque eu brequei os dois freios de uma vez. E o cara passou muito pouco do meu pneu pra passar por cima de mim. Se você não tiver atenção, né? Entendeu? Isso já aconteceu do cara me jogar dentro. Eu vi que eu desmaiei e fui parar no prótipo. faz tempo isso? faz tempo que eu bati a cabeça Certo, porque não respeita a ciclovia vermelha, porque quando é com o Meifiqui, né? Eles se respeitam mais, porque... Mas quando é só ciclofaixa assim, só pintura... É um desrespeito com a gente. O senhor tem medo de sofrer acidente quando anda de bicicleta? Tem, né? Eu já tenho... Cuidado, porque medo eu não tenho mais, porque eu sei que acontece, porque eu já tive um. Exatamente esse, eu tive um aqui. Não sei se dá pra perceber, mas se você ver, foi quando eu fui parar. O carro invadiu e simplesmente me rebolou. Outra vez eu estava trabalhando ali naquele edifício da Praça das Flores ali, no formato de um navio, do lado do hospital da polícia. Eu estava lá no Antônio Salles e o cara passou, me rebolou, se dasse por vindo que foi outro lasqueiro, que eu nem fui trabalhar nesse dia. Quem me atendeu foi o um cara, o próprio cara da da da da da da da da da da da da da da da da da da da da da da da da da da da da da da da da da da da da da da da da da da da da da da da da da da da da Eu ainda estava meio zonzo da pancada, da da que eu desmaiei, eu contei o motivo, porque eu tinha atrasado, né? Eu cheguei no trabalho quase 9 horas, aí o rapaz, o chefe, me chamou lá na sala, aí me deu uns dias pra ir pra casa, pediu pra mim ir, mandou o carro da empresa me deixar em casa, tomou biscoito dentro pra me deixar em casa, passou na UPA, Eu dou toda a assistência pra mim e tal. Aí eu fui me deixar em casa. E vários outros problemas que a gente passa no dia a dia sobre o desrespeito da gente que tiram o direito da gente da cidadania. Aí hoje o senhor gostaria de trocar de bicicleta por outro meio de transporte? Cara, é o seguinte, pra mim trocar minha bicicleta por outro meio de transporte, eu necessitaria de pelo menos uma habilitação pra eu poder terminar. até facilitar a minha vida, porque a minha vida já está bem corrida na bairro, aqui agora não consegue, mas eu sei dar cerinho. aí esse é o horário que eu vim pra cá porque eu também já tenho um problema que eu não tenho habitação porque eu perdi uma visão só que isso por causa, eu perdi uma e a outra tá muito baixa com o atendimento, terminei um tratamento agora pra não perder total e aí a bicicleta pra mim facilita mais, porque se eu for andar de moto já, né? tem que ter habitação, mas a moto também é o risco, é o medo É o pior do que o carro, é uma bicicleta. Enfim, a bicicleta pra mim tá dando, mas eu acho que ainda vou trocar de veículo ainda, mas depois que o meu filho tiver maior, ou de maior, daqui a três, quatro meses ele tá de maior, tirar a habilitação dele, colocar um transporte melhor pra ele trabalhar e pra mim também servir quando eu precisar ele me levar, me trazer pra vocão, me deixar, porque eu também trabalho na música, né?","Pessoa A: Muito bem.
Pessoa B: Como é o nome e a idade do senhor?
Pessoa A: Eu tenho, meu nome é Aurecédio Gonçalves, tenho 49.
Pessoa B: 49, né? Por que que o senhor escolheu andar de bicicleta?
Pessoa A: Cara, é assim, esse negócio de andar de bicicleta é uma coisa que já é, já é de, já vim do interior, que eu sou do interior.
Pessoa B: Entendi, é bem que sempre é dado.
Pessoa A: É bem que sempre é assim. Eu cheguei aqui em Fortaleza em 2001, mas nunca perdi o hábito de pedalar. A primeira coisa que eu consegui para mim foi uma bicicleta para ir trabalhar.
Pessoa B: Então, o seu pé dala desde sempre?
Pessoa A: Desde sempre.
Pessoa B: E qual é o principal problema que o senhor enfrenta andando de bicicleta aqui em Fortaleza?
Pessoa A: Do que de respeito com a gente, até nessas horas que você dentro da própria ciclovia, a gente enfrenta muita dificuldade. O motoqueiro vem contra a gente, O carro mesmo invade a ciclovia pra querer passar de outro. Aqui mesmo, nesse trecho aqui que eu já vou aqui, lá um pouco mais atrás... Uma moto foi entrar pro posto, nem sinal deu. Se eu não tivesse olhando bem, cuidadosamente, pra frente, tinha... Dois motoqueiros tinham fechado, outra vez foi um carro também.
Pessoa B: Geralmente, quando tem acesso assim, eles...
Pessoa A: Isso. Muitas vezes, eles aproveitam o posto pra disfarçar o que vai abastecer. Aí entra o posto, vê do posto, faz a volta pra pegar lá e tá aí.
Pessoa B: Pra seguir. Entendi. Furar o semáforo, né?
Pessoa A: Entra pelo posto pra furar o sinal. Pra pegar a outra que vem aqui e passar pra lá. E aí, no decorrer que eles fazem isso, eles prejudicam a gente, porque já enfrentei um momento que o cara tá dentro da ciclovia pra vir bater de frente comigo e me esculhambar, entendeu? Já peguei isso. Isso aqui, durante o dia, a gente passa por muita...
Pessoa B: O desrespeito, né, de motorista.
Pessoa A: Exatamente. É tanto que hoje...
Pessoa B: A principal reclamação das pessoas é essa mesmo.
Pessoa A: Pois é, o desrespeito com a gente, porque nós temos a nossa coisa e os caras que vêm pra fazer retorno, não de pegar cinco ou via, eles não respeitam aquela faixa grande e vermelha
Pessoa B: que tem lá com tudo certo.
Pessoa A: É parar aqui e o nosso EV ficar certo, porque se a via tá lá, tá dando... A gente tem o direito da gente ir. Eles param aqui pra deixar a gente passar. O cara quase me derruba, quase me joga no meio do outro lado, que eu tava com o jeito que veio de uma placarca. Passou quatro dedos daqui, porque eu brequei os dois freios de uma vez. E o cara passou muito pouco do meu pneu pra passar por cima de mim.
Pessoa B: Se você não tiver atenção, né? Entendeu?
Pessoa A: Isso já aconteceu do cara me jogar dentro. Eu vi que eu desmaiei e fui parar no prótipo.
Pessoa B: faz tempo isso?
Pessoa A: faz tempo que eu bati a cabeça Certo, porque não respeita a ciclovia vermelha, porque quando é com o Meifiqui, né? Eles se respeitam mais, porque...
Pessoa B: Mas quando é só ciclofaixa assim, só pintura...
Pessoa A: É um desrespeito com a gente.
Pessoa B: O senhor tem medo de sofrer acidente quando anda de bicicleta? Tem, né?
Pessoa A: Eu já tenho... Cuidado, porque medo eu não tenho mais, porque eu sei que acontece, porque eu já tive um. Exatamente esse, eu tive um aqui. Não sei se dá pra perceber, mas se você ver, foi quando eu fui parar. O carro invadiu e simplesmente me rebolou. Outra vez eu estava trabalhando ali naquele edifício da Praça das Flores ali, no formato de um navio, do lado do hospital da polícia. Eu estava lá no Antônio Salles e o cara passou, me rebolou, se dasse por vindo que foi outro lasqueiro, que eu nem fui trabalhar nesse dia. Quem me atendeu foi o um cara, o próprio cara da da da da da da da da da da da da da da da da da da
Pessoa B: da da da da da da da
Pessoa A: da da da da da da da da da da da da da da da
Pessoa B: da da da da da da
Pessoa A: da da da da da da Eu ainda estava meio zonzo da pancada, da da que eu desmaiei, eu contei o motivo, porque eu tinha atrasado, né? Eu cheguei no trabalho quase 9 horas, aí o rapaz, o chefe, me chamou lá na sala, aí me deu uns dias pra ir pra casa, pediu pra mim ir, mandou o carro da empresa me deixar em casa, tomou biscoito dentro pra me deixar em casa, passou na UPA, Eu dou toda a assistência pra mim e tal. Aí eu fui me deixar em casa. E vários outros problemas que a gente passa no dia a dia sobre o desrespeito da gente que tiram o direito da gente da cidadania.
Pessoa B: Aí hoje o senhor gostaria de trocar de bicicleta por outro meio de transporte?
Pessoa A: Cara, é o seguinte, pra mim trocar minha bicicleta por outro meio de transporte, eu necessitaria de pelo menos uma habilitação pra eu poder terminar. até facilitar a minha vida, porque a minha vida já está bem corrida na bairro, aqui agora não consegue, mas eu sei dar cerinho. aí esse é o horário que eu vim pra cá porque eu também já tenho um problema que eu não tenho habitação porque eu perdi uma visão só que isso por causa, eu perdi uma e a outra tá muito baixa com o atendimento, terminei um tratamento agora pra não perder total e aí a bicicleta pra mim facilita mais, porque se eu for andar de moto já, né? tem que ter habitação, mas a moto também é o risco, é o medo É o pior do que o carro, é uma bicicleta. Enfim, a bicicleta pra mim tá dando, mas eu acho que ainda vou trocar de veículo ainda, mas depois que o meu filho tiver maior, ou de maior, daqui a três, quatro meses ele tá de maior, tirar a habilitação dele, colocar um transporte melhor pra ele trabalhar e pra mim também servir quando eu precisar ele me levar, me trazer pra vocão, me deixar, porque eu também trabalho na música, né?",00003033-AUDIO-2026-02-26-16-42-44,Aurecédio Gonçalves,49,Masculino,"Cara, é assim, esse negócio de andar de bicicleta é uma coisa que já é, já é de, já vim do interior, que eu sou do interior. Entendi, é bem que sempre é dado. É bem que sempre é assim. Eu cheguei aqui em Fortaleza em 2001, mas nunca perdi o hábito de pedalar. A primeira coisa que eu consegui para mim foi uma bicicleta para ir trabalhar.","Eu cheguei aqui em Fortaleza em 2001, mas nunca perdi o hábito de pedalar. A primeira coisa que eu consegui para mim foi uma bicicleta para ir trabalhar. Então, o seu pé dala desde sempre? Desde sempre.","Do que de respeito com a gente, até nessas horas que você dentro da própria ciclovia, a gente enfrenta muita dificuldade. O motoqueiro vem contra a gente, O carro mesmo invade a ciclovia pra querer passar de outro. Aqui mesmo, nesse trecho aqui que eu já vou aqui, lá um pouco mais atrás... Uma moto foi entrar pro posto, nem sinal deu. Se eu não tivesse olhando bem, cuidadosamente, pra frente, tinha... Dois motoqueiros tinham fechado, outra vez foi um carro também. Geralmente, quando tem acesso assim, eles... Isso. Muitas vezes, eles aproveitam o posto pra disfarçar o que vai abastecer. Aí entra o posto, vê do posto, faz a volta pra pegar lá e tá aí. Pra seguir. Entendi. Furar o semáforo, né? Entra pelo posto pra furar o sinal. Pra pegar a outra que vem aqui e passar pra lá. E aí, no decorrer que eles fazem isso, eles prejudicam a gente, porque já enfrentei um momento que o cara tá dentro da ciclovia pra vir bater de frente comigo e me esculhambar, entendeu? Já peguei isso. Isso aqui, durante o dia, a gente passa por muita... O desrespeito, né, de motorista. Exatamente. É tanto que hoje... A principal reclamação das pessoas é essa mesmo. Pois é, o desrespeito com a gente, porque nós temos a nossa coisa e os caras que vêm pra fazer retorno, não de pegar cinco ou via, eles não respeitam aquela faixa grande e vermelha que tem lá com tudo certo. É parar aqui e o nosso EV ficar certo, porque se a via tá lá, tá dando... A gente tem o direito da gente ir. Eles param aqui pra deixar a gente passar. O cara quase me derruba, quase me joga no meio do outro lado, que eu tava com o jeito que veio de uma placarca. Passou quatro dedos daqui, porque eu brequei os dois freios de uma vez. E o cara passou muito pouco do meu pneu pra passar por cima de mim. Se você não tiver atenção, né? Entendeu? Isso já aconteceu do cara me jogar dentro. Eu vi que eu desmaiei e fui parar no prótipo. faz tempo isso? faz tempo que eu bati a cabeça Certo, porque não respeita a ciclovia vermelha, porque quando é com o Meifiqui, né? Eles se respeitam mais, porque... Mas quando é só ciclofaixa assim, só pintura... É um desrespeito com a gente. O senhor tem medo de sofrer acidente quando anda de bicicleta? Tem, né? Eu já tenho... Cuidado, porque medo eu não tenho mais, porque eu sei que acontece, porque eu já tive um. Exatamente esse, eu tive um aqui. Não sei se dá pra perceber, mas se você ver, foi quando eu fui parar. O carro invadiu e simplesmente me rebolou. Outra vez eu estava trabalhando ali naquele edifício da Praça das Flores ali, no formato de um navio, do lado do hospital da polícia. Eu estava lá no Antônio Salles e o cara passou, me rebolou, se dasse por vindo que foi outro lasqueiro, que eu nem fui trabalhar nesse dia.","O senhor tem medo de sofrer acidente quando anda de bicicleta? Tem, né? Eu já tenho... Cuidado, porque medo eu não tenho mais, porque eu sei que acontece, porque eu já tive um.","Já sofreu algum acidente, aliás, sofreu algum acidente no último ano? Não. Não, né?","Cara, é o seguinte, pra mim trocar minha bicicleta por outro meio de transporte, eu necessitaria de pelo menos uma habilitação pra eu poder terminar. até facilitar a minha vida, porque a minha vida já está bem corrida na bairro, aqui agora não consegue, mas eu sei dar cerinho. [...] Enfim, a bicicleta pra mim tá dando, mas eu acho que ainda vou trocar de veículo ainda, mas depois que o meu filho tiver maior, ou de maior, daqui a três, quatro meses ele tá de maior, tirar a habilitação dele, colocar um transporte melhor pra ele trabalhar e pra mim também servir quando eu precisar ele me levar, me trazer pra vocão, me deixar, porque eu também trabalho na música, né?",Por onde eu tô rodando tá tranquilo. Já tem? Tem.,Preferência pessoal; Praticidade e conveniência,Mais de 5 anos,Desrespeito dos motoristas ou Trânsito; Invasão de carros ou motos na ciclovia; Risco de acidentes,Não,Não,"Sim, por uma moto"
"Me fala teu nome e a tua idade. José Nildo de Souza, 58 anos. Por que você escolheu usar bicicleta? Porque é a maneira mais rápida de se locomover de um lado para o outro. Infelizmente o nosso transporte público não oferece essa rapidez. Você tem medo de sofrer acidente? Ah, como todo mundo, né? Todo mundo tem esse medo de sofrer um acidente, mas... Você já sofreu algum acidente? Ah, graças a Deus, nunca sofri. É... Você gostaria de trocar a bicicleta por outro meio de transporte? Com certeza, né? Um carro, se possível, né? Um futuro bem próximo. Tem alguma rua na cidade que você acha... Queria sugerir pra ter ciclofaixa, que hoje não tem? Ixi, agora de novo mesmo... De momento não. Tá bom, tudo bem. Aqui na Navarra, não sei se é mais, agora trocou-se todos os nomes, né? Ali que Perimetal, né? Perimetal seguindo pra lá. Isso. Depois do viaduto. É que não tem. Não tem, é. É a única, que aí também tem o fluxo dos ônibus, né? Também. Aí ninguém sabe. Aí tá pronto, a Perimetal pra lá. Beleza, já fica registrado. Obrigado, abraço.","Pessoa A: Me fala teu nome e a tua idade.
Pessoa B: José Nildo de Souza, 58 anos.
Pessoa A: Por que você escolheu usar bicicleta?
Pessoa B: Porque é a maneira mais rápida de se locomover de um lado para o outro. Infelizmente o nosso transporte público não oferece essa rapidez.
Pessoa A: Você tem medo de sofrer acidente?
Pessoa B: Ah, como todo mundo, né? Todo mundo tem esse medo de sofrer um acidente, mas... Você já sofreu algum acidente? Ah, graças a Deus, nunca sofri.
Pessoa A: É... Você gostaria de trocar a bicicleta por outro meio de transporte?
Pessoa B: Com certeza, né? Um carro, se possível, né? Um futuro bem próximo.
Pessoa A: Tem alguma rua na cidade que você acha... Queria sugerir pra ter ciclofaixa, que hoje não tem?
Pessoa B: Ixi, agora de novo mesmo... De
Pessoa A: momento não. Tá bom, tudo bem.
Pessoa B: Aqui na Navarra, não sei
Pessoa A: se é mais,
Pessoa B: agora trocou-se todos os nomes, né? Ali que Perimetal,
Pessoa A: né? Perimetal seguindo pra lá. Isso. Depois do viaduto. É que não tem. Não tem, é.
Pessoa B: É a única, que aí também tem o fluxo dos ônibus, né? Também. Aí ninguém sabe. Aí tá
Pessoa A: pronto, a Perimetal pra lá.
Pessoa B: Beleza,
Pessoa A: já fica registrado. Obrigado, abraço.",00003034-AUDIO-2026-02-26-16-43-29,José Nildo de Souza,58 anos,Masculino,Porque é a maneira mais rápida de se locomover de um lado para o outro. Infelizmente o nosso transporte público não oferece essa rapidez.,de um ano pra cá eu tô trabalhando com a iFood e entregando de bike.,"Fortaleza tem ciclovias bacanas, algumas elas estão precisando de reformas, elas estão bem estreitas ou tem calçada em cima da ciclovia, isso atrapalha um pouco.","Você tem medo de sofrer acidente? Ah, como todo mundo, né? Todo mundo tem esse medo de sofrer um acidente, mas... Você já sofreu algum acidente? Ah, graças a Deus, nunca sofri.","Já sofreu algum acidente, aliás, sofreu algum acidente no último ano? Não. Não, né?","Com certeza, né? Um carro, se possível, né? Um futuro bem próximo.","Tem alguma rua na cidade que você acha... Queria sugerir pra ter ciclofaixa, que hoje não tem? Ixi, agora de novo mesmo... De momento não. Tá bom, tudo bem. Aqui na Navarra, não sei se é mais, agora trocou-se todos os nomes, né? Ali que Perimetal, né? Perimetal seguindo pra lá. Isso. Depois do viaduto. É que não tem. Não tem, é. É a única, que aí também tem o fluxo dos ônibus, né? Também. Aí ninguém sabe. Aí tá pronto, a Perimetal pra lá. Beleza, já fica registrado. Obrigado, abraço.",Rapidez \ Tempo,Entre 1 e 2 anos,"Má qualidade das ciclovias, Outros obstáculos na ciclovia","Sim, tenho medo de acidentes",Não,"Sim, por um carro"
