text,conversation,file,nome,idade,gênero,por_que_escolheu_andar_de_bicicleta?,ha_quanto_tempo_utiliza?,qual_e_o_principal_problema_que_voce_enfrenta_ao_andar_de_bicicleta_em_fortaleza,tem_medo_de_sofrer_acidentes_andando_de_bicicleta_em_Fortaleza?,sofreu_algum_acidente_no_último_ano?,gostaria_de_trocar_a_bicicleta_por_outro_meio_de_transporte,existe_alguma_rua_em_fortaleza_em_que_gostaria_de_ver_uma_ciclovia,por_que_escolheu_ou_escolhe_andar_de_bicicleta_agrupado,ha_quanto_tempo_utiliza_agrupado,qual_e_o_principal_problema_que_voce_enfrenta_ao_andar_de_bicicleta_em_fortaleza_agrupado,tem_medo_de_sofrer_acidentes_andando_de_bicicleta_em_fortaleza_agrupado,sofreu_algum_acidente_no_ultimo_ano_agrupado,gostaria_de_trocar_a_bicicleta_por_outro_meio_de_transporte_agrupado
"Como é seu nome e sua idade? Damado Silvio de Sousa, 41 anos. Por que o senhor escolheu andar de bicicleta? É porque é mais fácil de acesso para mim. Eu moro aqui próximo, aí qualquer coisinha eu vou no centro ali. Entendi, acaba sendo mais rápido, mais flexível. Qual o principal problema que o senhor enfrenta quando anda de bicicleta em Fortaleza? É, o problema é que algumas ruas deveriam ter mais infraestrutura ciclofaixa, né? Porque, por exemplo, tem caminhão que eu vou e dá certinho uma ciclofaixa pra lá, mas aí tem caminhão que eu fico um pouco resguardado pra não confrontar com o carro, né? Isso aí é a falta de ciclofaixa, né? Isso. O senhor tem medo de sofrer acidente quando anda de bicicleta em Fortaleza? Aqui dentro eu tenho a minha segurança, porque eu já tenho a coisa do acesso, aí causa bem segurança pra mim. Entendi. E o senhor já sofreu algum acidente, Adan, de bike? De bicicleta não. Tá certo. O senhor gostaria de trocar hoje a bicicleta por outro meio de transporte, pra esses deslocamentos que o senhor faz hoje de bike? Não, esse deslocamento que eu faço não, não é precaria. Entendi. Existe alguma rua de Fortaleza que o senhor passe sempre assim, que não tem ciclo, mas que o pessoal acha que merecia muito ali naquela rua? Por exemplo, tem vários cantos, mas eu vou citar um que eu evito de frequentar lá, porque lá não tem. Lá é muito bom mesmo. É na Eduardo Porto. Aqui, na sequência desse daqui, ó. Ah, ali perto do shopping? Não, é já antes do shopping. Depois do shopping é em Porto. Agora chega no Sinai, até Eduardo Porto. Ah, certo. Mas aqui é muito. Tá certo. Mas é que eu evito de andar lá, porque... Porque não tem essa estrutura, é muito flexível de carro.","Pessoa A: Como é seu nome e sua idade? Damado Silvio de Sousa, 41 anos. Por que o senhor escolheu andar de bicicleta?
Pessoa B: É porque é mais fácil de acesso para mim. Eu moro
Pessoa A: aqui próximo,
Pessoa B: aí qualquer coisinha eu vou no centro ali. Entendi,
Pessoa A: acaba sendo mais rápido, mais flexível. Qual o principal problema que o senhor enfrenta quando anda de bicicleta em Fortaleza?
Pessoa B: É, o problema é que algumas ruas deveriam ter mais
Pessoa A: infraestrutura ciclofaixa, né?
Pessoa B: Porque, por exemplo, tem caminhão que eu vou e dá certinho uma ciclofaixa pra lá, mas aí tem caminhão que eu fico um pouco resguardado pra não
Pessoa A: confrontar com o carro, né? Isso aí é a falta de ciclofaixa, né? Isso. O senhor tem medo de sofrer acidente quando anda de bicicleta em Fortaleza?
Pessoa B: Aqui dentro eu tenho a minha segurança, porque eu já tenho a coisa do acesso,
Pessoa A: aí causa bem segurança pra mim. Entendi. E o senhor já sofreu algum acidente, Adan, de bike? De bicicleta não. Tá certo. O senhor gostaria de trocar hoje a bicicleta por outro meio de transporte, pra esses deslocamentos que o senhor faz hoje de bike?
Pessoa B: Não, esse deslocamento que eu faço não, não é precaria.
Pessoa A: Entendi. Existe alguma rua de Fortaleza que o senhor passe sempre assim, que não tem ciclo, mas que o pessoal acha que merecia muito ali naquela rua? Por exemplo,
Pessoa B: tem vários cantos, mas eu vou citar um que eu evito de frequentar lá, porque lá não tem. Lá é muito bom mesmo. É na Eduardo Porto. Aqui, na sequência desse daqui, ó.
Pessoa A: Ah, ali perto do shopping? Não, é já antes do shopping. Depois do
Pessoa B: shopping é em Porto. Agora chega no Sinai, até Eduardo Porto. Ah, certo. Mas aqui é muito. Tá certo. Mas é que eu evito de andar lá, porque... Porque não tem essa estrutura, é muito flexível de carro.",00003052-AUDIO-2026-02-26-17-02-04,Damado Silvio de Sousa,41 anos,Masculino,"É porque é mais fácil de acesso para mim. Eu moro aqui próximo, aí qualquer coisinha eu vou no centro ali.",de um ano pra cá eu tô trabalhando com a iFood e entregando de bike.,"É, o problema é que algumas ruas deveriam ter mais infraestrutura ciclofaixa, né? Porque, por exemplo, tem caminhão que eu vou e dá certinho uma ciclofaixa pra lá, mas aí tem caminhão que eu fico um pouco resguardado pra não confrontar com o carro, né? Isso aí é a falta de ciclofaixa, né?

Fortaleza tem ciclovias bacanas, algumas elas estão precisando de reformas, elas estão bem estreitas ou tem calçada em cima da ciclovia, isso atrapalha um pouco.","Aqui dentro eu tenho a minha segurança, porque eu já tenho a coisa do acesso, aí causa bem segurança pra mim. Entendi. E o senhor já sofreu algum acidente, Adan, de bike? De bicicleta não.","Já sofreu algum acidente, aliás, sofreu algum acidente no último ano? Não. Não, né?",Eu preciso de um bom carro pra mim.,"Existe alguma rua de Fortaleza que o senhor passe sempre assim, que não tem ciclo, mas que o pessoal acha que merecia muito ali naquela rua? Por exemplo, tem vários cantos, mas eu vou citar um que eu evito de frequentar lá, porque lá não tem. Lá é muito bom mesmo. É na Eduardo Porto. Aqui, na sequência desse daqui, ó. Ah, ali perto do shopping? Não, é já antes do shopping. Depois do shopping é em Porto. Agora chega no Sinai, até Eduardo Porto. Ah, certo. Mas aqui é muito. Tá certo. Mas é que eu evito de andar lá, porque... Porque não tem essa estrutura, é muito flexível de carro.",Praticidade e conveniência;Mais fácil,Entre 1 e 2 anos,Falta de ciclovias; Má qualidade das ciclovias; Desrespeito dos motoristas ou Trânsito; Outros obstáculos na ciclovia,Não,Não,"Sim, por um carro"
"Qual o nome da sua idade? É... sete, setenta. Setenta e sete? Não, setenta e sete. Ah, setenta, certo. Qual o nome do senhor? Fábio. Fábio, né? Por que você escolheu andar de bicicleta? Porque desde criança... Desde sempre já andava, então costumou andar de bike, né? Então faz muitos anos já que você anda de bicicleta, né? Mais de sete. Qual o principal problema que o senhor enfrenta ao andar de bicicleta em Fortaleza? Rapaz, é um... Os veículos, né? Os veículos, o resumento dos veículos, de jeito nenhum. Entendi. Ele só ia uma faixa dentro da outra faixa dos outros. Entendi. É, eu só tenho... É que aqui nunca aconteceu nada com isso, não. Ninguém faz isso aqui, não, não. Entendi. Nunca sofreu acidente de bicicleta, então. E o senhor tem medo de sofrer acidente quando está andando de bicicleta? Não, não, é que eu sempre ando... Prestando atenção, né? O senhor gostaria de trocar hoje a bicicleta por outro meio de transporte? Não. Eu vou ter que pegar outra moto. Entendi. Então a gente troca pela moto, né? Ah, entendi. Existe alguma rua de Fortaleza que a pessoa sempre passa, que não tem ciclofaxo, só acha que deveria ter? Tá bom, obrigado.","Pessoa B: Qual o nome da sua idade? É... sete, setenta. Setenta e sete? Não,
Pessoa A: setenta e sete. Ah,
Pessoa B: setenta, certo. Qual o nome do senhor?
Pessoa A: Fábio.
Pessoa B: Fábio, né? Por que você escolheu andar de bicicleta?
Pessoa A: Porque desde criança...
Pessoa B: Desde sempre já andava, então costumou andar de bike, né? Então faz muitos anos já que você anda de bicicleta, né? Mais de sete. Qual o principal problema que o senhor enfrenta ao andar de bicicleta em Fortaleza?
Pessoa A: Rapaz, é um...
Pessoa B: Os veículos, né? Os veículos, o resumento dos veículos, de jeito nenhum. Entendi.
Pessoa A: Ele só ia uma faixa dentro da outra faixa dos outros.
Pessoa B: Entendi. É, eu só
Pessoa A: tenho... É que aqui nunca aconteceu nada com isso, não. Ninguém faz isso aqui, não, não.
Pessoa B: Entendi. Nunca sofreu acidente de bicicleta, então.
Pessoa A: E
Pessoa B: o senhor tem medo de sofrer acidente quando está andando de bicicleta?
Pessoa A: Não, não, é que eu sempre ando...
Pessoa B: Prestando atenção, né? O senhor gostaria de trocar hoje a bicicleta por outro meio de transporte? Não. Eu vou ter que pegar outra moto. Entendi. Então a gente troca pela moto, né?
Pessoa A: Ah, entendi.
Pessoa B: Existe alguma rua de Fortaleza que a pessoa sempre passa, que não tem ciclofaxo, só acha que deveria ter?
Pessoa A: Tá
Pessoa B: bom, obrigado.",00003053-AUDIO-2026-02-26-17-04-17,Fábio,70,Masculino,"Porque desde criança... Desde sempre já andava, então costumou andar de bike, né? Há uns 4 anos atrás eu descobri o ciclismo e aprendi a gostar e de um ano pra cá eu tô trabalhando com a iFood e entregando de bike.","Desde criança... Desde sempre já andava, então costumou andar de bike, né? Então faz muitos anos já que você anda de bicicleta, né? Mais de sete.","Rapaz, é um... Os veículos, né? Os veículos, o resumento dos veículos, de jeito nenhum. Entendi. Ele só ia uma faixa dentro da outra faixa dos outros.","Não, não, é que eu sempre ando... Prestando atenção, né?","Já sofreu algum acidente, aliás, sofreu algum acidente no último ano? Não. Não, né?","Não. Eu vou ter que pegar outra moto. Entendi. Então a gente troca pela moto, né? Ah, entendi.",Por onde eu tô rodando tá tranquilo. Já tem? Tem.,Preferência pessoal,Mais de 5 anos,Desrespeito dos motoristas ou Trânsito; Invasão de carros ou motos na ciclovia,Não,Não,"Sim, por uma moto"
"Qual o seu nome e sua idade? André, tenho 49. Por que você escolheu andar de bicicleta e quanto tempo utiliza? Está com uns 3 anos já, que é saúde, né? Saúde eu acho que é de hoje. Chega mais rápido. E qual o principal problema que você enfrenta andando de bicicleta? É o trânsito. Respeito. Não respeito o ciclista, somente o botoqueiro. Você tem medo de sofrer acidente andando de bicicleta? Sim. Já sofreu? Não, graças a Deus não. Você gostaria de trocar a bicicleta por outro meio de transporte? Não, no momento não. Bicicleta é melhor. E existe alguma rua em Fortaleza que você gostaria de ver na ciclovia ou ciclofaixa que não tem ainda? Rapaz, aqui na Perimetral mesmo. Na Perimetral? Isso, é. Tem um pedaço aqui pra lá.","Pessoa A: Qual o seu nome e sua idade? André,
Pessoa B: tenho 49.
Pessoa A: Por que você escolheu andar de bicicleta e quanto tempo utiliza?
Pessoa B: Está com uns 3 anos já, que é saúde, né? Saúde eu acho que é de hoje. Chega mais rápido.
Pessoa A: E qual o principal problema que você enfrenta andando de bicicleta?
Pessoa B: É o trânsito. Respeito. Não respeito o ciclista, somente o botoqueiro.
Pessoa A: Você tem medo de sofrer acidente andando de bicicleta? Sim. Já sofreu?
Pessoa B: Não, graças a Deus não.
Pessoa A: Você gostaria de trocar a bicicleta por outro meio de transporte? Não, no momento não.
Pessoa B: Bicicleta é melhor.
Pessoa A: E existe alguma rua em Fortaleza que você gostaria de ver na ciclovia ou ciclofaixa que não tem ainda?
Pessoa B: Rapaz, aqui na Perimetral mesmo. Na Perimetral? Isso, é. Tem um pedaço aqui pra
Pessoa A: lá.",00003054-AUDIO-2026-02-26-17-04-51,André,49,Masculino,Há uns 4 anos atrás eu descobri o ciclismo e aprendi a gostar e de um ano pra cá eu tô trabalhando com a iFood e entregando de bike.,Está com uns 3 anos já,"Fortaleza tem ciclovias bacanas, algumas elas estão precisando de reformas, elas estão bem estreitas ou tem calçada em cima da ciclovia, isso atrapalha um pouco.","Você tem medo de sofrer acidente andando de bicicleta? Sim. Já sofreu? Não, graças a Deus não.","Já sofreu algum acidente, aliás, sofreu algum acidente no último ano? Não. Não, né?",Eu preciso de um bom carro pra mim.,"Rapaz, aqui na Perimetral mesmo. Na Perimetral? Isso, é. Tem um pedaço aqui pra lá.",Preferência pessoal; Praticidade e conveniência,Entre 3 e 5 anos,Má qualidade das ciclovias; Outros obstáculos na ciclovia,"Sim, tenho medo de acidentes",Não,"Sim, por um carro"
"Me diz, por favor, o teu nome e tua idade. É o Luiz Sérgio, 36. Luiz, por que que tu escolheu andar de bicicleta e há quanto tempo tu utiliza ela como meio de transporte? É porque eu tô trabalhando aqui perto, mas andar de bicicleta é melhor, por causa dos ônibus. Custa muito, né? Porque eu tô trabalhando a frente de trilho. Tem isso. Mais rápido, né? É. Qual que foi o problema que tu enfrenta ao andar de bicicleta, Luiz, em Porta Luz? É, as vezes é os motoristas de moto, né? Não respeita, né? Passa de uma vez, não espera a gente. Entendi. Tu tem algum medo de sofrer acidente andando de bike hoje? Eu não, eu não. Tu sofreu algum acidente no último ano andando de bike? Não, não. Graças a Deus. Tu gostaria de trocar a bicicleta por outro meio de transporte? Queria uma motinha. Uma motinha, né? E existe alguma rua em Fortaleza que não tenha ciclovias ou ciclopacha que tu queria que tivesse? Na... na... na Osso Suar... Merecia uma, né? Não, na Osso Suar já tem, né? Osso Suar já tem. Na BR, né? Era pra ter. Na BR, né? Na BR era pra ter. Legal. Eu não. Valeu. Obrigado, Galmin.","Pessoa A: Me diz, por favor, o teu nome e tua idade. É o Luiz Sérgio, 36. Luiz, por que que tu escolheu andar de bicicleta e há quanto tempo tu utiliza ela como meio de transporte? É porque eu tô trabalhando aqui perto, mas andar de bicicleta é melhor, por causa dos ônibus. Custa muito, né? Porque eu tô trabalhando a frente de trilho. Tem isso. Mais rápido, né? É. Qual que foi o problema que tu enfrenta ao andar de bicicleta, Luiz, em Porta Luz? É, as vezes é os motoristas de moto, né? Não respeita, né? Passa de uma vez, não espera a gente. Entendi. Tu tem algum medo de sofrer acidente andando de bike hoje? Eu não, eu não. Tu sofreu algum acidente no último ano andando de bike? Não, não. Graças a Deus. Tu gostaria de trocar a bicicleta por outro meio de transporte? Queria uma motinha. Uma motinha, né? E existe alguma rua em Fortaleza que não tenha ciclovias ou ciclopacha que tu queria que tivesse? Na... na... na Osso Suar... Merecia uma, né? Não, na Osso Suar já tem, né? Osso Suar já tem. Na BR, né? Era pra ter. Na BR, né? Na BR era pra ter. Legal. Eu não. Valeu. Obrigado, Galmin.",00003055-AUDIO-2026-02-26-17-05-39,Luiz Sérgio,36,Masculino,"Há uns 4 anos atrás eu descobri o ciclismo e aprendi a gostar e de um ano pra cá eu tô trabalhando com a iFood e entregando de bike. É porque eu tô trabalhando aqui perto, mas andar de bicicleta é melhor, por causa dos ônibus. Custa muito, né? Porque eu tô trabalhando a frente de trilho. Tem isso. Mais rápido, né?",de um ano pra cá eu tô trabalhando com a iFood e entregando de bike.,"É, as vezes é os motoristas de moto, né? Não respeita, né? Passa de uma vez, não espera a gente.","Eu não, eu não.","Tu sofreu algum acidente no último ano andando de bike? Não, não. Graças a Deus.","Tu gostaria de trocar a bicicleta por outro meio de transporte? Queria uma motinha. Uma motinha, né?","E existe alguma rua em Fortaleza que não tenha ciclovias ou ciclopacha que tu queria que tivesse? Na... na... na Osso Suar... Merecia uma, né? Não, na Osso Suar já tem, né? Osso Suar já tem. Na BR, né? Era pra ter. Na BR, né? Na BR era pra ter. Legal. Eu não. Valeu. Obrigado, Galmin.",Custo \ É mais barato;Rapidez \ Tempo,Entre 1 e 2 anos,Desrespeito dos motoristas ou Trânsito,Não,Não,"Sim, por uma moto"
"Me fala o teu nome e a tua idade. Francisco Ferreira de Lima, 5'3. Por que você escolheu usar a bicicleta? É porque pra mim sai bem melhor, porque além de ser melhor de chegar no trabalho, não dá certo não, demora demais, sai mais de conta. Tem quanto tempo que você usa a bicicleta? Pra falar a verdade, há mais de uns 20 anos. Qual o principal problema que você enfrenta ao usar bicicleta na cidade? Ah, o trânsito mesmo, né? Porque tem canto que não tem espaço nenhum, especialmente nessa avenida aqui. Essa avenida aqui que é uma movimentada, que eu ando mais nela. Já que você vai pro lado do centro, Castelão, você tem bastante problema. Mas pra cá, essa aqui precisa muito, mas não tem jeito. Essa aqui tem, né? Aqui, mas não tem pra lá, né? Depois não tem pra lá. Tem, eu vou depois do Zé Walter muito ainda, e não tem. Você tem medo de sofrer acidente? Tem, mas... Você já sofreu algum acidente? Não, graças a Deus, nunca encostei. Ninguém encostou em mim, graças a Deus. Você gostaria de trocar a bicicleta por outro meio de transporte? É, quem gosta, é porque é mais lágis. Um transporte mais... Melhor é, por exemplo, motos, essas coisas, né? Que é o que eu pretendo, né? Tem alguma rua que você gostaria de sugerir que tivesse ciclofaxe? Você falou lá Perimetral, né? Perimetral, é. Perimetral, é. Tá bom. Obrigado.","Pessoa A: Me fala o teu nome e a tua idade.
Pessoa B: Francisco Ferreira de Lima, 5'3. Por que você
Pessoa A: escolheu usar a bicicleta?
Pessoa B: É porque pra mim sai bem melhor, porque além de ser melhor de chegar no trabalho, não dá certo não, demora demais, sai mais de conta.
Pessoa A: Tem quanto tempo que você usa a bicicleta? Pra
Pessoa B: falar a verdade,
Pessoa A: há mais de uns 20 anos. Qual o principal problema que você enfrenta ao usar bicicleta na cidade?
Pessoa B: Ah, o trânsito mesmo, né? Porque tem canto que não tem espaço nenhum, especialmente nessa avenida aqui. Essa avenida aqui que é uma movimentada, que eu ando mais nela. Já que você vai pro lado do centro, Castelão, você tem bastante problema. Mas pra cá, essa aqui precisa muito, mas não tem jeito. Essa aqui tem, né? Aqui, mas não tem pra lá, né? Depois não tem pra lá. Tem, eu vou depois do Zé Walter muito ainda, e não tem.
Pessoa A: Você tem medo de sofrer acidente?
Pessoa B: Tem, mas...
Pessoa A: Você já sofreu algum acidente? Não, graças
Pessoa B: a Deus, nunca encostei. Ninguém encostou em mim, graças a Deus.
Pessoa A: Você gostaria de trocar a bicicleta por outro meio de transporte?
Pessoa B: É, quem gosta, é porque é mais lágis. Um transporte mais... Melhor é, por exemplo, motos, essas coisas, né? Que é o que eu pretendo, né?
Pessoa A: Tem alguma rua que você gostaria de sugerir que tivesse ciclofaxe? Você falou lá Perimetral, né?
Pessoa B: Perimetral, é. Perimetral,
Pessoa A: é. Tá bom. Obrigado.",00003056-AUDIO-2026-02-26-17-05-50,Francisco Ferreira de Lima,5'3,Masculino,"É porque pra mim sai bem melhor, porque além de ser melhor de chegar no trabalho, não dá certo não, demora demais, sai mais de conta.","Pra falar a verdade, há mais de uns 20 anos.","Ah, o trânsito mesmo, né? Porque tem canto que não tem espaço nenhum, especialmente nessa avenida aqui. Essa avenida aqui que é uma movimentada, que eu ando mais nela. Já que você vai pro lado do centro, Castelão, você tem bastante problema. Mas pra cá, essa aqui precisa muito, mas não tem jeito. Essa aqui tem, né? Aqui, mas não tem pra lá, né? Depois não tem pra lá. Tem, eu vou depois do Zé Walter muito ainda, e não tem.","Você tem medo de sofrer acidente? Tem, mas... Você já sofreu algum acidente? Não, graças a Deus, nunca encostei. Ninguém encostou em mim, graças a Deus.","Não. Não, né?","É, quem gosta, é porque é mais lágis. Um transporte mais... Melhor é, por exemplo, motos, essas coisas, né? Que é o que eu pretendo, né?","Tem alguma rua que você gostaria de sugerir que tivesse ciclofaxe? Você falou lá Perimetral, né? Perimetral, é. Perimetral, é.",Rapidez \ Tempo;Praticidade e conveniência;Custo \ É mais barato,Mais de 5 anos,Desrespeito dos motoristas ou Trânsito; Falta de ciclovias,"Sim, tenho medo de acidentes",Não,"Sim, por uma moto"
"Qual o seu nome e sua idade? Mônona da Silva. A idade é de 52. Por que você escolheu andar de bicicleta e quanto tempo utiliza? O tempo que pegar o ônibus demora mais, de bicicleta... Faz muito tempo que você anda? Faz. Desde 13 anos. E qual o principal problema que você enfrenta ao andar de bicicleta? Os carros, que às vezes não respeitam a gente. Tira fina. E aí a gente tem que ter muito cuidado. Com certeza. Você tem medo de sofrer acidente? Eu tenho. Mas eu sou muito cuidadoso, sabe? Sim. Eu ando muito com cuidado. Já sofreu algum ou não? Não, não, não. Só tirou o fino batendo, mas não chegou a cair não, sabe? Graças a Deus. Você gostaria de trocar a bicicleta por outro meio de transporte? Gostaria, mas por enquanto eu não estou podendo. Mas trocaria por qual? Por uma motinha, né? Motinha? Existe alguma rua que você gostaria de ver uma ciclovia, ciclofaixa, que ainda não tem? É a pele metálica, depois do viaduto. Sim, sério, várias pessoas já falaram. Pois é, ali não tem, ali é muito perigoso. Sim.","Pessoa B: Qual o seu nome e sua idade?
Pessoa A: Mônona da Silva. A idade é de 52.
Pessoa B: Por que você escolheu andar de bicicleta e quanto tempo utiliza?
Pessoa A: O tempo que pegar o ônibus demora mais, de bicicleta... Faz muito
Pessoa B: tempo que você anda? Faz.
Pessoa A: Desde 13 anos.
Pessoa B: E qual o principal problema que você enfrenta ao andar de bicicleta? Os carros,
Pessoa A: que às vezes não respeitam a gente. Tira fina. E aí a gente tem que ter muito cuidado.
Pessoa B: Com certeza. Você tem medo de sofrer acidente?
Pessoa A: Eu tenho. Mas eu sou muito cuidadoso, sabe? Sim. Eu ando muito com cuidado.
Pessoa B: Já sofreu algum ou não?
Pessoa A: Não, não, não. Só tirou o fino batendo, mas não chegou a cair não, sabe?
Pessoa B: Graças a Deus. Você gostaria de trocar a bicicleta
Pessoa A: por outro meio de transporte? Gostaria, mas por enquanto eu não estou podendo.
Pessoa B: Mas trocaria por qual?
Pessoa A: Por uma motinha, né?
Pessoa B: Motinha? Existe alguma rua que você gostaria de ver uma ciclovia, ciclofaixa, que ainda não tem?
Pessoa A: É a pele metálica, depois do viaduto.
Pessoa B: Sim, sério, várias pessoas já falaram. Pois
Pessoa A: é, ali não tem, ali é muito perigoso.
Pessoa B: Sim.",00003057-AUDIO-2026-02-26-17-06-13,Mônona da Silva,52,Feminino,"O tempo que pegar o ônibus demora mais, de bicicleta...",Faz. Desde 13 anos.,"Os carros, que às vezes não respeitam a gente. Tira fina. E aí a gente tem que ter muito cuidado. / Fortaleza tem ciclovias bacanas, algumas elas estão precisando de reformas, elas estão bem estreitas ou tem calçada em cima da ciclovia, isso atrapalha um pouco.","Você tem medo de sofrer acidente? Eu tenho. Mas eu sou muito cuidadoso, sabe? Sim. Eu ando muito com cuidado.","Já sofreu algum acidente, aliás, sofreu algum acidente no último ano? Não. Não, né? / Já sofreu algum ou não? Não, não, não. Só tirou o fino batendo, mas não chegou a cair não, sabe? Graças a Deus.","Gostaria, mas por enquanto eu não estou podendo. Mas trocaria por qual? Por uma motinha, né? Motinha?","Existe alguma rua que você gostaria de ver uma ciclovia, ciclofaixa, que ainda não tem? É a pele metálica, depois do viaduto.",Rapidez \ Tempo,Mais de 5 anos,Desrespeito dos motoristas ou Trânsito; Má qualidade das ciclovias; Outros obstáculos na ciclovia,"Sim, tenho medo de acidentes",Não,"Sim, por uma moto"
