text,conversation,file,nome,idade,gênero,por_que_escolheu_andar_de_bicicleta?,ha_quanto_tempo_utiliza?,qual_e_o_principal_problema_que_voce_enfrenta_ao_andar_de_bicicleta_em_fortaleza,tem_medo_de_sofrer_acidentes_andando_de_bicicleta_em_Fortaleza?,sofreu_algum_acidente_no_último_ano?,gostaria_de_trocar_a_bicicleta_por_outro_meio_de_transporte,existe_alguma_rua_em_fortaleza_em_que_gostaria_de_ver_uma_ciclovia,por_que_escolheu_ou_escolhe_andar_de_bicicleta_agrupado,ha_quanto_tempo_utiliza_agrupado,qual_e_o_principal_problema_que_voce_enfrenta_ao_andar_de_bicicleta_em_fortaleza_agrupado,tem_medo_de_sofrer_acidentes_andando_de_bicicleta_em_fortaleza_agrupado,sofreu_algum_acidente_no_ultimo_ano_agrupado,gostaria_de_trocar_a_bicicleta_por_outro_meio_de_transporte_agrupado
"Me diz o teu nome e tua idade? Watson Vinh... ou... Desculpa. Falando na idade, eu lembrei do ano passado. Mas é 37. Por que você escolheu usar a bicicleta? É uma mobilidade melhor e, às vezes, em locais que você quer entrar, não tem acesso a carro, não tem acesso a ônibus. Aí você tem que descer e ir a pé e levar um monte de coisa na sacola pra poder entregar. É mais prático, né? É mais prático. Tem quanto tempo que você usa a bicicleta? Sim, eu tenho 10, 12, 15 anos. Você tem medo de sofrer acidente? Eu já sofri vários. Já sofreu vários? Conta como foi um aí. O pior foi aqui descendo a... Só vim daqui... Perto do terminal aqui. Não, essa aqui. É, jornalista mais conhecido. Sim. Porque aí eu vim descendo, o cara tava saindo sem ligar o retrovisor, aí eu acertei... Oh, sem ligar o piscar. O piscar alerta, aí eu, pra desviar, eu conseguia ainda acertar só o retrovisor. Eu consegui desviar do carro, não bati no carro, mas acertei ainda o retrovisor. Tinha a ciclofaixa? Tava na ciclofaixa. Aí mesmo na ciclofaixa? Mesmo na ciclofaixa, ele foi, tirou o carro e como eu tava aqui no meio do caminho, se eu fosse entrar, eu ia bater em outro carro. Aí eu tive que botar entre a brecha. Aí quando eu botei entre a brecha, eu acertei o retrovisor dele, virei, a bicicleta caiu na frente e eu caí sentado. Ainda bem que eu só, parece que apoiei os dois pés e fiquei sentado, pronto. Aí passei ali, eu acho que uns 30 segundos olhando, mas foi como se eu não tivesse visto mais nada. E aí depois, quando eu olhei, eu fiquei sem saber o que é que eu tava vendo. Foi mesmo. Mas graças a Deus, sobrou só cicatriz aqui. Sim. Do retrovisor e arranhado. Mas graças a Deus, foi só isso. Que bom. E não fazendo nada pior. Não, mais sério, né? Qual o principal problema que você acha andando na cidade assim, que você enfrenta ao usar de bicicleta? Parra às vezes os buracos na ciclovia também, porque às vezes você pega a via dos carros por conta do buraco que tá na ciclovia. Você gostaria de trocar a bicicleta por outro meio de transporte? Eu tô querendo pegar uma moto mesmo pra poder facilitar, porque até mesmo você consegue chegar mais longe em menos tempo. E tem alguma rua que você acha que devia ter ciclovia, que hoje não tem, pra sugerir? Rapaz, tem um bocado. Tem alguma que tu lembre pra falar aqui? Que eu lembre é que... Alguma que hoje não tem, né? Que tu acha que era importante que tivesse. A Freixo e Cirilo seria uma boa ideia. E a Barão de Aquiraz. É, Barão de Aquiraz seria uma boa ideia. Tá bom, beleza. Obrigado.","Pessoa A: Me diz o teu nome e tua idade?
Pessoa B: Watson Vinh... ou... Desculpa. Falando na idade, eu lembrei do ano passado. Mas é 37.
Pessoa A: Por que você escolheu usar a bicicleta?
Pessoa B: É uma mobilidade melhor e, às vezes, em locais que você quer entrar, não tem acesso a carro, não tem acesso a ônibus. Aí você tem que descer e ir a pé e levar um monte de coisa na sacola pra poder entregar.
Pessoa A: É mais prático, né?
Pessoa B: É mais prático.
Pessoa A: Tem quanto tempo que você usa a bicicleta?
Pessoa B: Sim, eu tenho 10, 12, 15 anos.
Pessoa A: Você tem medo de sofrer acidente?
Pessoa B: Eu já sofri vários.
Pessoa A: Já sofreu vários? Conta como foi um aí.
Pessoa B: O pior foi aqui descendo a... Só vim daqui... Perto do terminal aqui. Não, essa aqui. É, jornalista mais conhecido. Sim. Porque aí eu vim descendo, o cara tava saindo sem ligar o retrovisor, aí eu acertei... Oh, sem ligar o piscar. O piscar alerta, aí eu, pra desviar, eu conseguia ainda acertar só o retrovisor. Eu consegui desviar do carro, não bati no carro, mas acertei ainda o retrovisor.
Pessoa A: Tinha a ciclofaixa?
Pessoa B: Tava na ciclofaixa.
Pessoa A: Aí mesmo na ciclofaixa?
Pessoa B: Mesmo na ciclofaixa, ele foi, tirou o carro e como eu tava aqui no meio do caminho, se eu fosse entrar, eu ia bater em outro carro. Aí eu tive que botar entre a brecha. Aí quando eu botei entre a brecha, eu acertei o retrovisor dele, virei, a bicicleta caiu na frente e eu caí sentado. Ainda bem que eu só, parece que apoiei os dois pés e fiquei sentado, pronto. Aí passei ali, eu acho que uns 30 segundos olhando, mas foi como se eu não tivesse visto mais nada. E aí depois, quando eu olhei, eu fiquei sem saber o que é que eu tava vendo.
Pessoa A: Foi mesmo.
Pessoa B: Mas graças a Deus, sobrou só cicatriz aqui.
Pessoa A: Sim.
Pessoa B: Do retrovisor e arranhado. Mas graças a Deus, foi só isso.
Pessoa A: Que bom.
Pessoa B: E não fazendo nada pior.
Pessoa A: Não, mais sério, né? Qual o principal problema que você acha andando na cidade assim, que você enfrenta ao usar de bicicleta?
Pessoa B: Parra às vezes os buracos na ciclovia também, porque às vezes você pega a via dos carros por conta do buraco que tá na ciclovia.
Pessoa A: Você gostaria de trocar a bicicleta por outro meio de transporte?
Pessoa B: Eu tô querendo pegar uma moto mesmo pra poder facilitar, porque até mesmo você consegue chegar mais longe em menos tempo.
Pessoa A: E tem alguma rua que você acha que devia ter ciclovia, que hoje não tem, pra sugerir?
Pessoa B: Rapaz, tem um bocado.
Pessoa A: Tem alguma que tu lembre pra falar aqui?
Pessoa B: Que eu lembre é que...
Pessoa A: Alguma que hoje não tem, né? Que tu acha que era importante que tivesse.
Pessoa B: A Freixo e Cirilo seria uma boa ideia. E a Barão de Aquiraz. É, Barão de Aquiraz seria uma boa ideia.
Pessoa A: Tá bom, beleza. Obrigado.",00003079-AUDIO-2026-02-26-17-21-15,Watson,37,Masculino,"É uma mobilidade melhor e, às vezes, em locais que você quer entrar, não tem acesso a carro, não tem acesso a ônibus. Aí você tem que descer e ir a pé e levar um monte de coisa na sacola pra poder entregar. É mais prático, né? É mais prático.","Sim, eu tenho 10, 12, 15 anos.","Parra às vezes os buracos na ciclovia também, porque às vezes você pega a via dos carros por conta do buraco que tá na ciclovia.",Você tem medo de sofrer acidente? Eu já sofri vários.,"Já sofreu algum acidente, aliás, sofreu algum acidente no último ano? Não. Não, né?","Eu tô querendo pegar uma moto mesmo pra poder facilitar, porque até mesmo você consegue chegar mais longe em menos tempo.","A Freixo e Cirilo seria uma boa ideia. E a Barão de Aquiraz. É, Barão de Aquiraz seria uma boa ideia.",Praticidade e conveniência,Mais de 5 anos,Buracos na ciclovia,"Sim, tenho medo de acidentes",Não,"Sim, por uma moto"
"É meio de um minuto. Me diz seu nome e a tua idade? Luiz... 58 anos. Luiz, por que que tu escolheu andar de bicicleta? E há quanto tempo tu utiliza ela como transporte? Rapaz, porque é muito mais prático pra gente ir e vir pro trabalho. Certo? E agora com essa ciclovia eu dei maior valor, porque eu trabalho na aldeia alta, em vários cantos. Aí a bicicleta ajuda muito, porque se for parar, pegar ônibus, demora mais. E outra, sem contar que... É um exercício, pra minha idade é muito bom, né? E eu desde... Toda a vida eu usei bicicleta. Há quanto tempo o senhor anda de bicicleta? Rapaz, desde os meus dez anos de idade. Então aí tem uns... Trinta anos aí. Quarenta anos... É uns cinquenta anos que eu ando. De bike, né? É, só de bicicleta. Meu movimento é bicicleta. Pra todo canto que eu vou é bicicleta. E qual pessoal problema que o senhor enfrenta ao andar de bicicleta hoje em Fortaleza? Não, primeiro eu enfrentava era que não tinha espaço pra gente ir e vir, a aldeia era muito apertada e a gente ficava meio que incomodado por meio de acidente. Agora não, com essa ciclovia, a gente anda a fortaleza todinha. Às vezes tem uns carros que invadem a via da gente, mas a gente com cuidado dá pra ir e vir. Então, nesses 40 anos que eu trabalho em Fortaleza, que eu trabalho de PD na construção, né? Toda vida eu fui e vim de bicicleta. Até agora eu nunca sofri acidente, não. E agora tá bem melhor. Mas tu tem medo de sofrer acidente, de andar de bicicleta? Não, eu não sou nervoso, não. Eu ando... Tranquilo. Sempre com cuidado, né? Pedalando, olhando pra trás e tudo. Com cuidado, né? Tu nunca... Eu não. E tu não sofreu nenhum acidente no último ano? Não, de jeito nenhum, até agora. Tu gosta de deixar a tua bicicleta pra algum outro meio de transporte? Eu não, eu andava de moto, né? Eu tenho um carro guardado na garagem, mas eu não... Prefiro a bicicleta. E moto também, eu também sou motoqueiro, sou habilitado, né? Carro e moto. Mas no momento eu sou mais, dei a moto pro meu menino e eu ando mais de bicicleta. Eu acho melhor. Existe alguma rua aqui em Fortaleza que não tem ciclovias ciclopáticas? Que o senhor queria que tivesse? Rapaz, ali quem vai pra Lagoa Redonda, Eu acho que ali ele já estava precisando, que lá não tem não, mas que é para onde eu vou agora, né? Na lagoa redonda não tem. Sabe o nome da rua? É a... Nelson Coelho, né? Francisco Leandro, parece que é Nelson Coelho, é uma coisa assim. Entendi. Tá bom. É isso. Obrigado.","Pessoa A: É meio de um minuto. Me diz seu nome e a tua idade?
Pessoa B: Luiz... 58 anos.
Pessoa A: Luiz, por que que tu escolheu andar de bicicleta? E há quanto tempo tu utiliza ela como transporte?
Pessoa B: Rapaz, porque é muito mais prático pra gente ir e vir pro trabalho. Certo? E agora com essa ciclovia eu dei maior valor, porque eu trabalho na aldeia alta, em vários cantos. Aí a bicicleta ajuda muito, porque se for parar, pegar ônibus, demora mais. E outra, sem contar que... É um exercício, pra minha idade é muito bom, né? E eu desde... Toda a vida eu usei bicicleta.
Pessoa A: Há quanto tempo o senhor anda de bicicleta?
Pessoa B: Rapaz, desde os meus dez anos de idade.
Pessoa A: Então aí tem uns...
Pessoa B: Trinta anos aí. Quarenta anos... É uns cinquenta anos que eu ando.
Pessoa A: De bike, né?
Pessoa B: É, só de bicicleta. Meu movimento é bicicleta. Pra todo canto que eu vou é bicicleta.
Pessoa A: E qual pessoal problema que o senhor enfrenta ao andar de bicicleta hoje em Fortaleza?
Pessoa B: Não, primeiro eu enfrentava era que não tinha espaço pra gente ir e vir, a aldeia era muito apertada e a gente ficava meio que incomodado por meio de acidente. Agora não, com essa ciclovia, a gente anda a fortaleza todinha. Às vezes tem uns carros que invadem a via da gente, mas a gente com cuidado dá pra ir e vir. Então, nesses 40 anos que eu trabalho em Fortaleza, que eu trabalho de PD na construção, né? Toda vida eu fui e vim de bicicleta. Até agora eu nunca sofri acidente, não. E agora tá bem melhor.
Pessoa A: Mas tu tem medo de sofrer acidente, de andar de bicicleta?
Pessoa B: Não, eu não sou nervoso, não. Eu ando...
Pessoa A: Tranquilo.
Pessoa B: Sempre com cuidado, né? Pedalando, olhando pra trás e tudo. Com cuidado, né? Tu nunca... Eu não.
Pessoa A: E tu não sofreu nenhum acidente no último ano?
Pessoa B: Não, de jeito nenhum, até agora.
Pessoa A: Tu gosta de deixar a tua bicicleta pra algum outro meio de transporte?
Pessoa B: Eu não, eu andava de moto, né? Eu tenho um carro guardado na garagem, mas eu não... Prefiro a bicicleta. E moto também, eu também sou motoqueiro, sou habilitado, né? Carro e moto. Mas no momento eu sou mais, dei a moto pro meu menino e eu ando mais de bicicleta. Eu acho melhor.
Pessoa A: Existe alguma rua aqui em Fortaleza que não tem ciclovias ciclopáticas? Que o senhor queria que tivesse?
Pessoa B: Rapaz, ali quem vai pra Lagoa Redonda, Eu acho que ali ele já estava precisando, que lá não tem não, mas que é para onde eu vou agora, né? Na lagoa redonda não tem.
Pessoa A: Sabe o nome da rua?
Pessoa B: É a... Nelson Coelho, né? Francisco Leandro, parece que é Nelson Coelho, é uma coisa assim.
Pessoa A: Entendi. Tá bom. É isso. Obrigado.",00003080-AUDIO-2026-02-26-17-22-17,Luiz,58 anos,Masculino,"Rapaz, porque é muito mais prático pra gente ir e vir pro trabalho. Certo? E agora com essa ciclovia eu dei maior valor, porque eu trabalho na aldeia alta, em vários cantos. Aí a bicicleta ajuda muito, porque se for parar, pegar ônibus, demora mais. E outra, sem contar que... É um exercício, pra minha idade é muito bom, né?","Toda a vida eu usei bicicleta. Há quanto tempo o senhor anda de bicicleta? Rapaz, desde os meus dez anos de idade. Então aí tem uns... Trinta anos aí. Quarenta anos... É uns cinquenta anos que eu
ando.","Não, primeiro eu enfrentava era que não tinha espaço pra gente ir e vir, a aldeia era muito apertada e a gente ficava meio que incomodado por meio de acidente. Agora não, com essa ciclovia, a gente anda a fortaleza todinha. Às vezes tem uns carros que invadem a via da gente, mas a gente com cuidado dá pra ir e vir.","Não, eu não sou nervoso, não. Eu ando... Tranquilo. Sempre com cuidado, né? Pedalando, olhando pra trás e tudo. Com cuidado, né? Tu nunca... Eu não. E tu não sofreu nenhum acidente no último ano? Não, de jeito nenhum, até agora.","Não, de jeito nenhum, até agora.","Eu não, eu andava de moto, né? Eu tenho um carro guardado na garagem, mas eu não... Prefiro a bicicleta. E moto também, eu também sou motoqueiro, sou habilitado, né? Carro e moto. Mas no momento eu sou mais, dei a moto pro meu menino e eu ando mais de bicicleta. Eu acho melhor.","Existe alguma rua aqui em Fortaleza que não tem ciclovias ciclopáticas? Que o senhor queria que tivesse? Rapaz, ali quem vai pra Lagoa Redonda, Eu acho que ali ele já estava precisando, que lá não tem não, mas que é para onde eu vou agora, né? Na lagoa redonda não tem. Sabe o nome da rua? É a... Nelson Coelho, né? Francisco Leandro, parece que é Nelson Coelho, é uma coisa assim.",Exercício e saúde;Rapidez \ Tempo;Praticidade e conveniência,Mais de 5 anos,Invasão de carros ou motos na ciclovia; Risco de acidentes,Não,Não,Não
"Qual o seu nome e sua idade? Cisco Thiago Beto Nicolau. E a sua idade? 30 e 40 anos. Por que você escolheu andar de bicicleta e quanto tempo usa? Desde os 18 anos, é mais saudável. E qual o principal problema que você sofre andando de bicicleta? Então assim, eu acho melhor assim, melhor que coletivo, porque vem apertado, suado, e eu acho que eu levo menos tempo pra chegar pro trabalho. Entendi. Ou ainda demoro mais. Mas não tem nada desconfortável assim que você acha? Não. Eu acho. Não tem muita ciclovía pra ciclista. Entendi. E você tem medo de sofrer acidente no meio de bicicleta? Não, não. Já sofreu algum? Já, mas foi leve. Levantei rapidinho. Só foi a batida, eu caí, mas levantei. Entendi. Foi bicicleta, bicicleta. Ah, tá. Você gostaria de trocar bicicleta por algum outro meio de transporte? Pretendo, moto. É, eu já tirei minha habitação e em breve vou para a minha mãe. Entendi. E existe alguma rua que você gostaria de ter uma escolvilha escolfácea? Que não tem ainda? Perimetral, não tem ainda. Perimetral, né? Não tem, é que é meu curso ali que é alta. Não tem. Pronto. É só isso, moço.","Pessoa A: Qual o seu nome e sua idade?
Pessoa B: Cisco Thiago Beto Nicolau.
Pessoa A: E a sua idade?
Pessoa B: 30 e 40 anos.
Pessoa A: Por que você escolheu andar de bicicleta e quanto tempo usa?
Pessoa B: Desde os 18 anos, é mais saudável.
Pessoa A: E qual o principal problema que você sofre andando de bicicleta?
Pessoa B: Então assim, eu acho melhor assim, melhor que coletivo, porque vem apertado, suado, e eu acho que eu levo menos tempo pra chegar pro trabalho. Entendi. Ou ainda demoro mais.
Pessoa A: Mas não tem nada desconfortável assim que você acha? Não.
Pessoa B: Eu acho. Não tem muita ciclovía pra ciclista. Entendi.
Pessoa A: E você tem medo de sofrer acidente no meio de bicicleta? Não, não. Já sofreu algum?
Pessoa B: Já, mas foi leve. Levantei rapidinho. Só foi a batida, eu caí, mas levantei. Entendi. Foi bicicleta, bicicleta.
Pessoa A: Ah, tá. Você gostaria de trocar bicicleta por algum outro meio de transporte?
Pessoa B: Pretendo, moto.
Pessoa A: É,
Pessoa B: eu já tirei minha habitação e em breve vou para a minha mãe.
Pessoa A: Entendi. E existe alguma rua que você gostaria de ter uma escolvilha escolfácea? Que não tem ainda?
Pessoa B: Perimetral,
Pessoa A: não tem ainda. Perimetral, né? Não
Pessoa B: tem, é que é meu curso ali que é alta.
Pessoa A: Não tem. Pronto. É só
Pessoa B: isso, moço.",00003081-AUDIO-2026-02-26-17-23-19,Cisco Thiago Beto Nicolau,30,Masculino,"Há uns 4 anos atrás eu descobri o ciclismo e aprendi a gostar e de um ano pra cá eu tô trabalhando com a iFood e entregando de bike. Desde os 18 anos, é mais saudável. Então assim, eu acho melhor assim, melhor que coletivo, porque vem apertado, suado, e eu acho que eu levo menos tempo pra chegar pro trabalho.",Desde os 18 anos,"Fortaleza tem ciclovias bacanas, algumas elas estão precisando de reformas, elas estão bem estreitas ou tem calçada em cima da ciclovia, isso atrapalha um pouco.","Não, não.","Não. Não, né?","Pretendo, moto.","E existe alguma rua que você gostaria de ter uma escolvilha escolfácea? Que não tem ainda? Perimetral, não tem ainda. Perimetral, né? Não tem, é que é meu curso ali que é alta. Não tem.",Exercício e saúde;Rapidez \ Tempo;Praticidade e conveniência,Mais de 5 anos,Má qualidade das ciclovias; Outros obstáculos na ciclovia,Não,Não,"Sim, por uma moto"
"Vamos lá. Qual o seu nome e sua idade? Valdízio. Rodrigues da Silva. Estou, não é? Não. Qual o nome e a sua idade? Valdízio. É... 54 anos. Valdízio, por que você escolheu andar de bicicleta e há quanto tempo você utiliza ela como transporte? Eu acho que tem mais de 10 anos. E por que você escolheu ela? Porque é melhor. Mais rápido? Mais rápido do que o transporte coletivo. Qual o pessoal problema que tu enfrenta andando de bike aqui em Fortaleza? Muitas vezes o trânsito, né? O pessoal não respeita? O pessoal não respeita. Mesmo assim na faixa o povo ainda não respeita. Tu tem medo de sofrer algum acidente andando de bike? Nunca. Tem medo? Tenho. Tenho muito medo. Sofreu algum acidente no último ano? Não. Legal. Tu gostaria de trocar bicicleta por outro meio de transporte? Com certeza. Com qual? Com a moto. Legal. Existe alguma rua em Fortaleza que não tem ciclofata ou ciclovia? Que tu queria que tivesse? Que eu me lembro, não. Tá bom. Obrigado, Valdezinho.","Pessoa B: Vamos lá.
Pessoa A: Qual o seu nome e sua idade?
Pessoa B: Valdízio. Rodrigues da Silva. Estou, não é?
Pessoa A: Não. Qual o nome e a sua idade?
Pessoa B: Valdízio. É... 54 anos.
Pessoa A: Valdízio, por que você escolheu andar de bicicleta e há quanto tempo você utiliza ela como transporte?
Pessoa B: Eu acho que tem mais de 10 anos.
Pessoa A: E por que você escolheu ela?
Pessoa B: Porque é melhor.
Pessoa A: Mais rápido? Mais
Pessoa B: rápido do que o transporte coletivo.
Pessoa A: Qual o pessoal problema que tu enfrenta andando de bike aqui em Fortaleza?
Pessoa B: Muitas vezes o trânsito, né?
Pessoa A: O pessoal não respeita?
Pessoa B: O pessoal não respeita. Mesmo assim na faixa o povo ainda não respeita.
Pessoa A: Tu tem medo de sofrer algum acidente andando de bike?
Pessoa B: Nunca.
Pessoa A: Tem medo?
Pessoa B: Tenho.
Pessoa A: Tenho muito medo. Sofreu algum acidente no último ano?
Pessoa B: Não.
Pessoa A: Legal. Tu gostaria de trocar bicicleta por outro meio de transporte?
Pessoa B: Com certeza.
Pessoa A: Com qual?
Pessoa B: Com a moto.
Pessoa A: Legal. Existe alguma rua em Fortaleza que não tem ciclofata ou ciclovia? Que tu queria que tivesse?
Pessoa B: Que eu me lembro, não.
Pessoa A: Tá bom. Obrigado, Valdezinho.",00003082-AUDIO-2026-02-26-17-23-36,Valdízio,54 anos,Masculino,Há uns 4 anos atrás eu descobri o ciclismo e aprendi a gostar e de um ano pra cá eu tô trabalhando com a iFood e entregando de bike.,Eu acho que tem mais de 10 anos.,"Muitas vezes o trânsito, né? O pessoal não respeita? O pessoal não respeita. Mesmo assim na faixa o povo ainda não respeita.",Tenho. Tenho muito medo.,Sofreu algum acidente no último ano? Não.,Tu gostaria de trocar bicicleta por outro meio de transporte? Com certeza. Com qual? Com a moto. Legal.,"Existe alguma rua em Fortaleza que não tem ciclofata ou ciclovia? Que tu queria que tivesse? Que eu me lembro, não.",Preferência pessoal,Mais de 5 anos,Desrespeito dos motoristas ou Trânsito,"Sim, tenho medo de acidentes",Não,"Sim, por uma moto"
"Como é o nome e a idade do senhor? Alex. Alex, né? Tem quantos anos, Alex? Eu tenho 39. 39. Por que você escolheu andar de bike? O meu tipo de transporte que eu vejo que é ter mais saúde e chegar rápido nos objetivos. Não sei como é que nem uma moto, mas eu consigo chegar nos meus objetivos com mais facilidade. Com mais rapidez. Há quanto tempo que tu anda de bicicleta, já? Sempre cada ano, mais de 17 anos. 17 anos. Tempo. Tu gostaria de trocar a bicicleta por outro meio de transporte hoje? É que eu já tive a oportunidade. Eu tenho um carro, tenho moto, mas eu prefiro andar de bike. Qual o principal problema que tu enfrenta quando andas de bicicleta em Fortaleza? É a falta de respeito. A gente tem que estar passando dos carros, porque tem rua que não tem passagem pra gente. Às vezes a gente fica lambado sem motivo nenhum. Não dá pra passar naquela faixa. É um dos motivos mais problemáticos. Tu tem medo de sofrer acidente quando tá andando de bike? Eu tenho e não, porque eu sou muito atento, mas eu tenho. Tem que cuidar, mas obviamente você já tem, né? Já sofreu um acidente alguma vez? A pessoa foi entrar e não ligou o pisco, né? Sim. A entrada de lote é sempre complicado. Isso, verdade. Aí a última pergunta era a rua que você gostaria de ter, a Frensirilo. Tá registrado aqui. Tá bom, muito obrigado.","Pessoa A: Como é o nome e a idade do senhor? Alex. Alex, né? Tem quantos anos, Alex? Eu tenho 39. 39. Por que você escolheu andar de bike? O meu tipo de transporte que eu vejo que é ter mais saúde e chegar rápido nos objetivos. Não sei como é que nem uma moto, mas eu consigo chegar nos meus objetivos com mais facilidade. Com mais rapidez. Há quanto tempo que tu anda de bicicleta, já? Sempre cada ano, mais de 17 anos. 17 anos. Tempo. Tu gostaria de trocar a bicicleta por outro meio de transporte hoje? É que eu já tive a oportunidade. Eu tenho um carro, tenho moto, mas eu prefiro andar de bike. Qual o principal problema que tu enfrenta quando andas de bicicleta em Fortaleza? É a falta de respeito. A gente tem que estar passando dos carros, porque tem rua que não tem passagem pra gente. Às vezes a gente fica lambado sem motivo nenhum. Não dá pra passar naquela faixa. É um dos motivos mais problemáticos. Tu tem medo de sofrer acidente quando tá andando de bike? Eu tenho e não, porque eu sou muito atento, mas eu tenho. Tem que cuidar, mas obviamente você já tem, né? Já sofreu um acidente alguma vez? A pessoa foi entrar e não ligou o pisco, né? Sim. A entrada de lote é sempre complicado. Isso, verdade. Aí a última pergunta era a rua que você gostaria de ter, a Frensirilo. Tá registrado aqui. Tá bom, muito obrigado.",00003083-AUDIO-2026-02-26-17-23-59,Alex,39,Masculino,"O meu tipo de transporte que eu vejo que é ter mais saúde e chegar rápido nos objetivos. Não sei como é que nem uma moto, mas eu consigo chegar nos meus objetivos com mais facilidade. Com mais rapidez.","Sempre cada ano, mais de 17 anos. 17 anos. Tempo.","Qual o principal problema que tu enfrenta quando andas de bicicleta em Fortaleza? É a falta de respeito. A gente tem que estar passando dos carros, porque tem rua que não tem passagem pra gente. Às vezes a gente fica lambado sem motivo nenhum. Não dá pra passar naquela faixa. É um dos motivos mais problemáticos.","Tu tem medo de sofrer acidente quando tá andando de bike? Eu tenho e não, porque eu sou muito atento, mas eu tenho.","Não. Não, né?","É que eu já tive a oportunidade. Eu tenho um carro, tenho moto, mas eu prefiro andar de bike.","Aí a última pergunta era a rua que você gostaria de ter, a Frensirilo.",Exercício e saúde;Rapidez \ Tempo;Praticidade e conveniência,Mais de 5 anos,Desrespeito dos motoristas ou Trânsito; Falta de ciclovias,"Sim, tenho medo de acidentes",Não,Não
